,query,reference_contexts,reference_answer,reference_answer_by,query_by
24,"What prompted Charles Darwin to begin writing his paper on natural selection in May 1856, and how did this initial plan evolve over time?","['=== Publication of the theory of natural selection ===\n\nBy the start of 1856, Darwin was investigating whether eggs and seeds could survive travel across seawater to spread species across oceans. Hooker increasingly doubted the traditional view that species were fixed, but their young friend Thomas Henry Huxley was still firmly against the transmutation of species. Lyell was intrigued by Darwin\'s speculations without realising their extent. When he read a paper by Alfred Russel Wallace, ""On the Law which has Regulated the Introduction of New Species"", he saw similarities with Darwin\'s thoughts and urged him to publish to establish precedence.\nThough Darwin saw no threat, on 14 May 1856 he began writing a short paper. Finding answers to difficult questions held him up repeatedly, and he expanded his plans to a ""big book on species"" titled Natural Selection, which was to include his ""note on Man"". He continued his research, obtaining information and specimens from naturalists worldwide, including Wallace who was working in Borneo.\nIn mid-1857, he added a section heading, ""Theory applied to Races of Man"", but did not add text on this topic. On 5 September 1857, Darwin sent the American botanist Asa Gray a detailed outline of his ideas, including an abstract of Natural Selection, which omitted human origins and sexual selection. In December, Darwin received a letter from Wallace asking if the book would examine human origins. He responded that he would avoid that subject, ""so surrounded with prejudices"", while encouraging Wallace\'s theorising and adding that ""I go much further than you.""\nDarwin\'s book was only partly written when, on 18 June 1858, he received a paper from Wallace describing natural selection. Shocked that he had been ""forestalled"", Darwin sent it on that day to Lyell, as requested by Wallace, and although Wallace had not asked for publication, Darwin suggested he would send it to any journal that Wallace chose. His family was in crisis, with children in the village dying of scarlet fever, and he put matters in the hands of his friends. After some discussion, with no reliable way of involving Wallace, Lyell and Hooker decided on a joint presentation at the Linnean Society on 1 July of On the Tendency of Species to form Varieties; and on the Perpetuation of Varieties and Species by Natural Means of Selection. On the evening of 28 June, Darwin\'s baby son died of scarlet fever after almost a week of severe illness, and he was too distraught to attend.\nThere was little immediate attention to this announcement of the theory; the president of the Linnean Society remarked in May 1859 that the year had not been marked by any revolutionary discoveries. Only one review rankled enough for Darwin to recall it later; Professor Samuel Haughton of Dublin claimed that ""all that was new in them was false, and what was true was old"". Darwin struggled for thirteen months to produce an abstract of his ""big book"", suffering from ill health but getting constant encouragement from his scientific friends. Lyell arranged to have it published by John Murray.\nOn the Origin of Species proved unexpectedly popular, with the entire stock of 1,250 copies oversubscribed when it went on sale to booksellers on 22 November 1859. In the book, Darwin set out ""one long argument"" of detailed observations, inferences and consideration of anticipated objections. In making the case for common descent, he included evidence of homologies between humans and other mammals.[III] Having outlined sexual selection, he hinted that it could explain differences between human races.[IV] He avoided explicit discussion of human origins, but implied the significance of his work with the sentence; ""Light will be thrown on the origin of man and his history.""[IV] His theory is simply stated in the introduction:\n\nAs many more individuals of each species are born than can possibly survive; and as, consequently, there is a frequently recurring struggle for existence, it follows that any being, if it vary however slightly in any manner profitable to itself, under the complex and sometimes varying conditions of life, will have a better chance of surviving, and thus be naturally selected. From the strong principle of inheritance, any selected variety will tend to propagate its new and modified form.\nAt the end of the book, he concluded that:\n\nThere is grandeur in this view of life, with its several powers, having been originally breathed into a few forms or into one; and that, whilst this planet has gone cycling on according to the fixed law of gravity, from so simple a beginning endless forms most beautiful and most wonderful have been, and are being, evolved.\nThe last word was the only variant of ""evolved"" in the first five editions of the book. ""Evolutionism"" at that time was associated with other concepts, most commonly with embryological development.']","Charles Darwin began writing a short paper on natural selection in May 1856 after being urged by Charles Lyell. Lyell had read a paper by Alfred Russel Wallace titled ""On the Law which has Regulated the Introduction of New Species"" and saw similarities with Darwin's own ideas. Concerned about establishing precedence, Lyell encouraged Darwin to publish his thoughts.

Initially, Darwin planned to write a brief paper but found himself addressing complex questions that led him to expand his work into a more comprehensive project titled ""Natural Selection."" This expanded plan included various topics such as the application of his theory to different species and even humans. Over time, Darwin continued to gather information and specimens from naturalists worldwide, including Wallace.

In mid-1857, he added a section heading titled ""Theory applied to Races of Man,"" although he did not include text on this topic at that point. By September 1857, Darwin had shared an outline of his ideas with the American botanist Asa Gray, which included an abstract of Natural Selection but omitted discussions on human origins and sexual selection.

The plan for a ""big book"" evolved further when Darwin received a paper from Wallace in June 1858 that described natural selection. This prompted Darwin to expedite his work due to concerns about being ""forestalled."" The situation led to a joint presentation with Wallace's ideas at the Linnean Society on July 1, 1858.

Ultimately, Darwin's initial plan for a short paper evolved into the comprehensive and influential book ""On the Origin of Species,"" published in November 1859. This work laid out detailed observations and arguments supporting his theory of natural selection.",ai (phi4),ai (phi4)
25,"Describe the circumstances surrounding the joint presentation of Darwin's and Wallace's ideas at the Linnean Society on July 1, 1858.","['=== Publication of the theory of natural selection ===\n\nBy the start of 1856, Darwin was investigating whether eggs and seeds could survive travel across seawater to spread species across oceans. Hooker increasingly doubted the traditional view that species were fixed, but their young friend Thomas Henry Huxley was still firmly against the transmutation of species. Lyell was intrigued by Darwin\'s speculations without realising their extent. When he read a paper by Alfred Russel Wallace, ""On the Law which has Regulated the Introduction of New Species"", he saw similarities with Darwin\'s thoughts and urged him to publish to establish precedence.\nThough Darwin saw no threat, on 14 May 1856 he began writing a short paper. Finding answers to difficult questions held him up repeatedly, and he expanded his plans to a ""big book on species"" titled Natural Selection, which was to include his ""note on Man"". He continued his research, obtaining information and specimens from naturalists worldwide, including Wallace who was working in Borneo.\nIn mid-1857, he added a section heading, ""Theory applied to Races of Man"", but did not add text on this topic. On 5 September 1857, Darwin sent the American botanist Asa Gray a detailed outline of his ideas, including an abstract of Natural Selection, which omitted human origins and sexual selection. In December, Darwin received a letter from Wallace asking if the book would examine human origins. He responded that he would avoid that subject, ""so surrounded with prejudices"", while encouraging Wallace\'s theorising and adding that ""I go much further than you.""\nDarwin\'s book was only partly written when, on 18 June 1858, he received a paper from Wallace describing natural selection. Shocked that he had been ""forestalled"", Darwin sent it on that day to Lyell, as requested by Wallace, and although Wallace had not asked for publication, Darwin suggested he would send it to any journal that Wallace chose. His family was in crisis, with children in the village dying of scarlet fever, and he put matters in the hands of his friends. After some discussion, with no reliable way of involving Wallace, Lyell and Hooker decided on a joint presentation at the Linnean Society on 1 July of On the Tendency of Species to form Varieties; and on the Perpetuation of Varieties and Species by Natural Means of Selection. On the evening of 28 June, Darwin\'s baby son died of scarlet fever after almost a week of severe illness, and he was too distraught to attend.\nThere was little immediate attention to this announcement of the theory; the president of the Linnean Society remarked in May 1859 that the year had not been marked by any revolutionary discoveries. Only one review rankled enough for Darwin to recall it later; Professor Samuel Haughton of Dublin claimed that ""all that was new in them was false, and what was true was old"". Darwin struggled for thirteen months to produce an abstract of his ""big book"", suffering from ill health but getting constant encouragement from his scientific friends. Lyell arranged to have it published by John Murray.\nOn the Origin of Species proved unexpectedly popular, with the entire stock of 1,250 copies oversubscribed when it went on sale to booksellers on 22 November 1859. In the book, Darwin set out ""one long argument"" of detailed observations, inferences and consideration of anticipated objections. In making the case for common descent, he included evidence of homologies between humans and other mammals.[III] Having outlined sexual selection, he hinted that it could explain differences between human races.[IV] He avoided explicit discussion of human origins, but implied the significance of his work with the sentence; ""Light will be thrown on the origin of man and his history.""[IV] His theory is simply stated in the introduction:\n\nAs many more individuals of each species are born than can possibly survive; and as, consequently, there is a frequently recurring struggle for existence, it follows that any being, if it vary however slightly in any manner profitable to itself, under the complex and sometimes varying conditions of life, will have a better chance of surviving, and thus be naturally selected. From the strong principle of inheritance, any selected variety will tend to propagate its new and modified form.\nAt the end of the book, he concluded that:\n\nThere is grandeur in this view of life, with its several powers, having been originally breathed into a few forms or into one; and that, whilst this planet has gone cycling on according to the fixed law of gravity, from so simple a beginning endless forms most beautiful and most wonderful have been, and are being, evolved.\nThe last word was the only variant of ""evolved"" in the first five editions of the book. ""Evolutionism"" at that time was associated with other concepts, most commonly with embryological development.']","The joint presentation of Charles Darwin's and Alfred Russel Wallace's ideas at the Linnean Society on July 1, 1858, occurred under unique and somewhat dramatic circumstances. Here are the key points surrounding this event:

1. **Convergence of Ideas**: Both Darwin and Wallace had independently developed similar theories regarding natural selection as a mechanism for evolution. This convergence prompted concern about establishing precedence.

2. **Wallace's Paper**: On June 18, 1858, Darwin received a paper from Wallace that outlined the concept of natural selection. This was alarming to Darwin because it seemed Wallace had arrived at conclusions very similar to his own, which he had been developing for over two decades but had not yet published.

3. **Darwin's Response**: Shocked by the similarity and concerned about being ""forestalled,"" Darwin acted quickly. He sent Wallace’s paper to Charles Lyell, a mutual friend and influential geologist, as requested by Wallace. Although Wallace did not explicitly ask for his ideas to be published, Darwin suggested that he would send it to any journal Wallace preferred.

4. **Family Crisis**: At the same time, Darwin was dealing with personal tragedy. His baby son had died of scarlet fever on June 28, leaving him too distraught to attend the presentation at the Linnean Society himself.

5. **Lyell and Hooker's Role**: With no reliable way to involve Wallace directly in the decision-making process, Lyell and Joseph Dalton Hooker (another close friend and botanist) decided that a joint presentation of both Darwin’s and Wallace’s ideas would be appropriate. This was intended to give credit to both men for their contributions.

6. **Presentation Details**: The papers presented were titled ""On the Tendency of Species to form Varieties; and on the Perpetuation of Varieties and Species by Natural Means of Selection."" Despite the significance of the content, there was little immediate attention or impact from this presentation at the time.

This event marked a pivotal moment in the history of evolutionary biology, setting the stage for Darwin's later publication of ""On the Origin of Species"" in 1859.",ai (phi4),ai (phi4)
26,"How was ""On the Origin of Species"" received upon its release in November 1859, and what key argument did Darwin present in the introduction of this work?","['=== Publication of the theory of natural selection ===\n\nBy the start of 1856, Darwin was investigating whether eggs and seeds could survive travel across seawater to spread species across oceans. Hooker increasingly doubted the traditional view that species were fixed, but their young friend Thomas Henry Huxley was still firmly against the transmutation of species. Lyell was intrigued by Darwin\'s speculations without realising their extent. When he read a paper by Alfred Russel Wallace, ""On the Law which has Regulated the Introduction of New Species"", he saw similarities with Darwin\'s thoughts and urged him to publish to establish precedence.\nThough Darwin saw no threat, on 14 May 1856 he began writing a short paper. Finding answers to difficult questions held him up repeatedly, and he expanded his plans to a ""big book on species"" titled Natural Selection, which was to include his ""note on Man"". He continued his research, obtaining information and specimens from naturalists worldwide, including Wallace who was working in Borneo.\nIn mid-1857, he added a section heading, ""Theory applied to Races of Man"", but did not add text on this topic. On 5 September 1857, Darwin sent the American botanist Asa Gray a detailed outline of his ideas, including an abstract of Natural Selection, which omitted human origins and sexual selection. In December, Darwin received a letter from Wallace asking if the book would examine human origins. He responded that he would avoid that subject, ""so surrounded with prejudices"", while encouraging Wallace\'s theorising and adding that ""I go much further than you.""\nDarwin\'s book was only partly written when, on 18 June 1858, he received a paper from Wallace describing natural selection. Shocked that he had been ""forestalled"", Darwin sent it on that day to Lyell, as requested by Wallace, and although Wallace had not asked for publication, Darwin suggested he would send it to any journal that Wallace chose. His family was in crisis, with children in the village dying of scarlet fever, and he put matters in the hands of his friends. After some discussion, with no reliable way of involving Wallace, Lyell and Hooker decided on a joint presentation at the Linnean Society on 1 July of On the Tendency of Species to form Varieties; and on the Perpetuation of Varieties and Species by Natural Means of Selection. On the evening of 28 June, Darwin\'s baby son died of scarlet fever after almost a week of severe illness, and he was too distraught to attend.\nThere was little immediate attention to this announcement of the theory; the president of the Linnean Society remarked in May 1859 that the year had not been marked by any revolutionary discoveries. Only one review rankled enough for Darwin to recall it later; Professor Samuel Haughton of Dublin claimed that ""all that was new in them was false, and what was true was old"". Darwin struggled for thirteen months to produce an abstract of his ""big book"", suffering from ill health but getting constant encouragement from his scientific friends. Lyell arranged to have it published by John Murray.\nOn the Origin of Species proved unexpectedly popular, with the entire stock of 1,250 copies oversubscribed when it went on sale to booksellers on 22 November 1859. In the book, Darwin set out ""one long argument"" of detailed observations, inferences and consideration of anticipated objections. In making the case for common descent, he included evidence of homologies between humans and other mammals.[III] Having outlined sexual selection, he hinted that it could explain differences between human races.[IV] He avoided explicit discussion of human origins, but implied the significance of his work with the sentence; ""Light will be thrown on the origin of man and his history.""[IV] His theory is simply stated in the introduction:\n\nAs many more individuals of each species are born than can possibly survive; and as, consequently, there is a frequently recurring struggle for existence, it follows that any being, if it vary however slightly in any manner profitable to itself, under the complex and sometimes varying conditions of life, will have a better chance of surviving, and thus be naturally selected. From the strong principle of inheritance, any selected variety will tend to propagate its new and modified form.\nAt the end of the book, he concluded that:\n\nThere is grandeur in this view of life, with its several powers, having been originally breathed into a few forms or into one; and that, whilst this planet has gone cycling on according to the fixed law of gravity, from so simple a beginning endless forms most beautiful and most wonderful have been, and are being, evolved.\nThe last word was the only variant of ""evolved"" in the first five editions of the book. ""Evolutionism"" at that time was associated with other concepts, most commonly with embryological development.']","""On the Origin of Species"" was unexpectedly popular upon its release on 22 November 1859. The entire stock of 1,250 copies was oversubscribed when it went on sale to booksellers, indicating a high level of interest and demand for Darwin's work.

In the introduction of ""On the Origin of Species,"" Charles Darwin presented his key argument centered around natural selection. He explained that more individuals of each species are born than can possibly survive, leading to a struggle for existence. As a result, any individual with variations that provide an advantage under the complex and varying conditions of life will have a better chance of surviving and reproducing. This process of ""natural selection"" allows advantageous traits to be passed on to future generations. Darwin emphasized this principle by stating: 

""As many more individuals of each species are born than can possibly survive; and as, consequently, there is a frequently recurring struggle for existence, it follows that any being, if it vary however slightly in any manner profitable to itself, under the complex and sometimes varying conditions of life, will have a better chance of surviving, and thus be naturally selected. From the strong principle of inheritance, any selected variety will tend to propagate its new and modified form.""

This argument laid the foundation for Darwin's theory of evolution by natural selection, suggesting that species evolve over time through this process.",ai (phi4),ai (phi4)
