,query,reference_contexts,reference_answer,reference_answer_by,query_by
12,"What significant prediction about Darwin's future reputation was made by Sedgwick, and where did Darwin first learn of this?","['He later wrote that such facts ""seemed to me to throw some light on the origin of species"".\nWithout telling Darwin, extracts from his letters to Henslow had been read to scientific societies, printed as a pamphlet for private distribution among members of the Cambridge Philosophical Society, and reported in magazines, including The Athenaeum. Darwin first heard of this at Cape Town, and at Ascension Island read of Sedgwick\'s prediction that Darwin ""will have a great name among the Naturalists of Europe"".\n\n\n=== Inception of Darwin\'s evolutionary theory ===\n\nOn 2 October 1836, Beagle anchored at Falmouth, Cornwall. Darwin promptly made the long coach journey to Shrewsbury to visit his home and see relatives. He then hurried to Cambridge to see Henslow, who advised him on finding available naturalists to catalogue Darwin\'s animal collections and to take on the botanical specimens. Darwin\'s father organised investments, enabling his son to be a self-funded gentleman scientist, and an excited Darwin went around the London institutions being fêted and seeking experts to describe the collections. British zoologists at the time had a huge backlog of work, due to natural history collecting being encouraged throughout the British Empire, and there was a danger of specimens just being left in storage.\nCharles Lyell eagerly met Darwin for the first time on 29 October and soon introduced him to the up-and-coming anatomist Richard Owen, who had the facilities of the Royal College of Surgeons to work on the fossil bones collected by Darwin. Owen\'s surprising results included other gigantic extinct ground sloths as well as the Megatherium Darwin had identified, a near complete skeleton of the unknown Scelidotherium and a hippopotamus-sized rodent-like skull named Toxodon resembling a giant capybara. The armour fragments were actually from Glyptodon, a huge armadillo-like creature, as Darwin had initially thought. These extinct creatures were related to living species in South America.\nIn mid-December, Darwin took lodgings in Cambridge to arrange expert classification of his collections, and prepare his own research for publication. Questions of how to combine his diary into the Narrative were resolved at the end of the month when FitzRoy accepted Broderip\'s advice to make it a separate volume, and Darwin began work on his Journal and Remarks.\nDarwin\'s first paper showed that the South American landmass was slowly rising. With Lyell\'s enthusiastic backing, he read it to the Geological Society of London on 4 January 1837. On the same day, he presented his mammal and bird specimens to the Zoological Society. The ornithologist John Gould soon announced that the Galápagos birds that Darwin had thought a mixture of blackbirds, ""gros-beaks"" and finches, were, in fact, twelve separate species of finches. On 17 February, Darwin was elected to the Council of the Geological Society, and Lyell\'s presidential address presented Owen\'s findings on Darwin\'s fossils, stressing geographical continuity of species as supporting his uniformitarian ideas.\n\nEarly in March, Darwin moved to London to be near this work, joining Lyell\'s social circle of scientists and experts such as Charles Babbage, who described God as a programmer of laws. Darwin stayed with his freethinking brother Erasmus, part of this Whig circle and a close friend of the writer Harriet Martineau, who promoted the Malthusianism that underpinned the controversial Whig Poor Law reforms to stop welfare from causing overpopulation and more poverty. As a Unitarian, she welcomed the radical implications of transmutation of species, promoted by Grant and younger surgeons influenced by Geoffroy. Transmutation was anathema to Anglicans defending social order, but reputable scientists openly discussed the subject, and there was wide interest in John Herschel\'s letter praising Lyell\'s approach as a way to find a natural cause of the origin of new species.\nGould met Darwin and told him that the Galápagos mockingbirds from different islands were separate species, not just varieties, and what Darwin had thought was a ""wren"" was in the finch group. Darwin had not labelled the finches by island, but from the notes of others on the ship, including FitzRoy, he allocated species to islands. The two rheas were distinct species, and on 14 March Darwin announced how their distribution changed going southwards.\nBy mid-March 1837, barely six months after his return to England, Darwin was speculating in his Red Notebook on the possibility that ""one species does change into another"" to explain the geographical distribution of living species such as the rheas, and extinct ones such as the strange extinct mammal Macrauchenia, which resembled a giant guanaco, a llama relative. Around mid-July, he recorded in his ""B"" notebook his thoughts on lifespan and variation across generations – explaining the variations he had observed in Galápagos tortoises, mockingbirds, and rheas. He sketched branching descent, and then a genealogical branching of a single evolutionary tree, in which ""It is absurd to talk of one animal being higher than another"", thereby discarding Lamarck\'s idea of independent lineages progressing to higher forms.']","Sedgwick predicted that Charles Darwin ""will have a great name among the Naturalists of Europe."" Darwin first learned of this prediction at Cape Town. He later read about it on Ascension Island. This information was shared without his prior knowledge, as extracts from his letters to Henslow had been disseminated in scientific circles and reported in magazines like The Athenaeum.",ai (phi4),ai (phi4)
13,Describe the role Richard Owen played in analyzing Charles Darwin's fossil collections and name at least two extinct creatures identified from these fossils.,"['He later wrote that such facts ""seemed to me to throw some light on the origin of species"".\nWithout telling Darwin, extracts from his letters to Henslow had been read to scientific societies, printed as a pamphlet for private distribution among members of the Cambridge Philosophical Society, and reported in magazines, including The Athenaeum. Darwin first heard of this at Cape Town, and at Ascension Island read of Sedgwick\'s prediction that Darwin ""will have a great name among the Naturalists of Europe"".\n\n\n=== Inception of Darwin\'s evolutionary theory ===\n\nOn 2 October 1836, Beagle anchored at Falmouth, Cornwall. Darwin promptly made the long coach journey to Shrewsbury to visit his home and see relatives. He then hurried to Cambridge to see Henslow, who advised him on finding available naturalists to catalogue Darwin\'s animal collections and to take on the botanical specimens. Darwin\'s father organised investments, enabling his son to be a self-funded gentleman scientist, and an excited Darwin went around the London institutions being fêted and seeking experts to describe the collections. British zoologists at the time had a huge backlog of work, due to natural history collecting being encouraged throughout the British Empire, and there was a danger of specimens just being left in storage.\nCharles Lyell eagerly met Darwin for the first time on 29 October and soon introduced him to the up-and-coming anatomist Richard Owen, who had the facilities of the Royal College of Surgeons to work on the fossil bones collected by Darwin. Owen\'s surprising results included other gigantic extinct ground sloths as well as the Megatherium Darwin had identified, a near complete skeleton of the unknown Scelidotherium and a hippopotamus-sized rodent-like skull named Toxodon resembling a giant capybara. The armour fragments were actually from Glyptodon, a huge armadillo-like creature, as Darwin had initially thought. These extinct creatures were related to living species in South America.\nIn mid-December, Darwin took lodgings in Cambridge to arrange expert classification of his collections, and prepare his own research for publication. Questions of how to combine his diary into the Narrative were resolved at the end of the month when FitzRoy accepted Broderip\'s advice to make it a separate volume, and Darwin began work on his Journal and Remarks.\nDarwin\'s first paper showed that the South American landmass was slowly rising. With Lyell\'s enthusiastic backing, he read it to the Geological Society of London on 4 January 1837. On the same day, he presented his mammal and bird specimens to the Zoological Society. The ornithologist John Gould soon announced that the Galápagos birds that Darwin had thought a mixture of blackbirds, ""gros-beaks"" and finches, were, in fact, twelve separate species of finches. On 17 February, Darwin was elected to the Council of the Geological Society, and Lyell\'s presidential address presented Owen\'s findings on Darwin\'s fossils, stressing geographical continuity of species as supporting his uniformitarian ideas.\n\nEarly in March, Darwin moved to London to be near this work, joining Lyell\'s social circle of scientists and experts such as Charles Babbage, who described God as a programmer of laws. Darwin stayed with his freethinking brother Erasmus, part of this Whig circle and a close friend of the writer Harriet Martineau, who promoted the Malthusianism that underpinned the controversial Whig Poor Law reforms to stop welfare from causing overpopulation and more poverty. As a Unitarian, she welcomed the radical implications of transmutation of species, promoted by Grant and younger surgeons influenced by Geoffroy. Transmutation was anathema to Anglicans defending social order, but reputable scientists openly discussed the subject, and there was wide interest in John Herschel\'s letter praising Lyell\'s approach as a way to find a natural cause of the origin of new species.\nGould met Darwin and told him that the Galápagos mockingbirds from different islands were separate species, not just varieties, and what Darwin had thought was a ""wren"" was in the finch group. Darwin had not labelled the finches by island, but from the notes of others on the ship, including FitzRoy, he allocated species to islands. The two rheas were distinct species, and on 14 March Darwin announced how their distribution changed going southwards.\nBy mid-March 1837, barely six months after his return to England, Darwin was speculating in his Red Notebook on the possibility that ""one species does change into another"" to explain the geographical distribution of living species such as the rheas, and extinct ones such as the strange extinct mammal Macrauchenia, which resembled a giant guanaco, a llama relative. Around mid-July, he recorded in his ""B"" notebook his thoughts on lifespan and variation across generations – explaining the variations he had observed in Galápagos tortoises, mockingbirds, and rheas. He sketched branching descent, and then a genealogical branching of a single evolutionary tree, in which ""It is absurd to talk of one animal being higher than another"", thereby discarding Lamarck\'s idea of independent lineages progressing to higher forms.']","Richard Owen played a significant role in analyzing Charles Darwin's fossil collections by utilizing his expertise as an anatomist and the facilities available at the Royal College of Surgeons. Owen examined the fossil bones that Darwin had collected during his voyage on the HMS Beagle, particularly those from South America. His analysis led to several surprising discoveries about extinct creatures.

Two notable extinct creatures identified from these fossils were:

1. **Glyptodon**: Initially thought by Darwin to be fragments of armor, Owen confirmed that they belonged to Glyptodon, a large armadillo-like creature.
   
2. **Scelidotherium**: Owen discovered a near-complete skeleton of this unknown species, which added to the understanding of extinct South American megafauna.

Additionally, Owen identified other significant finds such as another gigantic extinct ground sloth and a rodent-like skull named Toxodon, resembling a giant capybara. These discoveries were crucial in demonstrating the relationship between these extinct creatures and living species in South America, supporting Darwin's developing ideas on evolution and natural history.",ai (phi4),ai (phi4)
14,"How did John Gould contribute to Darwin's understanding of species variation among the Galápagos birds, and what was the impact on Darwin's theory?","['He later wrote that such facts ""seemed to me to throw some light on the origin of species"".\nWithout telling Darwin, extracts from his letters to Henslow had been read to scientific societies, printed as a pamphlet for private distribution among members of the Cambridge Philosophical Society, and reported in magazines, including The Athenaeum. Darwin first heard of this at Cape Town, and at Ascension Island read of Sedgwick\'s prediction that Darwin ""will have a great name among the Naturalists of Europe"".\n\n\n=== Inception of Darwin\'s evolutionary theory ===\n\nOn 2 October 1836, Beagle anchored at Falmouth, Cornwall. Darwin promptly made the long coach journey to Shrewsbury to visit his home and see relatives. He then hurried to Cambridge to see Henslow, who advised him on finding available naturalists to catalogue Darwin\'s animal collections and to take on the botanical specimens. Darwin\'s father organised investments, enabling his son to be a self-funded gentleman scientist, and an excited Darwin went around the London institutions being fêted and seeking experts to describe the collections. British zoologists at the time had a huge backlog of work, due to natural history collecting being encouraged throughout the British Empire, and there was a danger of specimens just being left in storage.\nCharles Lyell eagerly met Darwin for the first time on 29 October and soon introduced him to the up-and-coming anatomist Richard Owen, who had the facilities of the Royal College of Surgeons to work on the fossil bones collected by Darwin. Owen\'s surprising results included other gigantic extinct ground sloths as well as the Megatherium Darwin had identified, a near complete skeleton of the unknown Scelidotherium and a hippopotamus-sized rodent-like skull named Toxodon resembling a giant capybara. The armour fragments were actually from Glyptodon, a huge armadillo-like creature, as Darwin had initially thought. These extinct creatures were related to living species in South America.\nIn mid-December, Darwin took lodgings in Cambridge to arrange expert classification of his collections, and prepare his own research for publication. Questions of how to combine his diary into the Narrative were resolved at the end of the month when FitzRoy accepted Broderip\'s advice to make it a separate volume, and Darwin began work on his Journal and Remarks.\nDarwin\'s first paper showed that the South American landmass was slowly rising. With Lyell\'s enthusiastic backing, he read it to the Geological Society of London on 4 January 1837. On the same day, he presented his mammal and bird specimens to the Zoological Society. The ornithologist John Gould soon announced that the Galápagos birds that Darwin had thought a mixture of blackbirds, ""gros-beaks"" and finches, were, in fact, twelve separate species of finches. On 17 February, Darwin was elected to the Council of the Geological Society, and Lyell\'s presidential address presented Owen\'s findings on Darwin\'s fossils, stressing geographical continuity of species as supporting his uniformitarian ideas.\n\nEarly in March, Darwin moved to London to be near this work, joining Lyell\'s social circle of scientists and experts such as Charles Babbage, who described God as a programmer of laws. Darwin stayed with his freethinking brother Erasmus, part of this Whig circle and a close friend of the writer Harriet Martineau, who promoted the Malthusianism that underpinned the controversial Whig Poor Law reforms to stop welfare from causing overpopulation and more poverty. As a Unitarian, she welcomed the radical implications of transmutation of species, promoted by Grant and younger surgeons influenced by Geoffroy. Transmutation was anathema to Anglicans defending social order, but reputable scientists openly discussed the subject, and there was wide interest in John Herschel\'s letter praising Lyell\'s approach as a way to find a natural cause of the origin of new species.\nGould met Darwin and told him that the Galápagos mockingbirds from different islands were separate species, not just varieties, and what Darwin had thought was a ""wren"" was in the finch group. Darwin had not labelled the finches by island, but from the notes of others on the ship, including FitzRoy, he allocated species to islands. The two rheas were distinct species, and on 14 March Darwin announced how their distribution changed going southwards.\nBy mid-March 1837, barely six months after his return to England, Darwin was speculating in his Red Notebook on the possibility that ""one species does change into another"" to explain the geographical distribution of living species such as the rheas, and extinct ones such as the strange extinct mammal Macrauchenia, which resembled a giant guanaco, a llama relative. Around mid-July, he recorded in his ""B"" notebook his thoughts on lifespan and variation across generations – explaining the variations he had observed in Galápagos tortoises, mockingbirds, and rheas. He sketched branching descent, and then a genealogical branching of a single evolutionary tree, in which ""It is absurd to talk of one animal being higher than another"", thereby discarding Lamarck\'s idea of independent lineages progressing to higher forms.']","John Gould played a crucial role in advancing Charles Darwin's understanding of species variation among the Galápagos birds. Initially, Darwin had collected various bird specimens from the Galápagos Islands during his voyage on the HMS Beagle and believed they were a mixture of blackbirds, ""gros-beaks,"" and finches. However, when he presented these specimens to John Gould, an expert ornithologist, Gould made a significant discovery: the birds that Darwin had collected were not just variations within a single species but actually comprised twelve distinct species of finches.

This revelation was pivotal for Darwin's developing theory of evolution by natural selection. It provided concrete evidence that closely related species could vary significantly from one another and be adapted to different environments, even within a relatively small geographic area like the Galápagos Islands. This observation supported the idea that species were not immutable but could change over time in response to their environment.

The impact on Darwin's theory was profound. The variation among the finches suggested that they might have evolved from a common ancestor and adapted to different ecological niches on the islands, leading to speciation. This insight contributed to Darwin's formulation of his ideas about natural selection as a mechanism for evolution, where advantageous traits become more common in a population over generations due to differential survival and reproduction.

Overall, Gould's identification of the finches as distinct species was instrumental in shaping Darwin's thoughts on how species could diversify and adapt, laying foundational concepts for what would later be articulated in his seminal work, ""On the Origin of Species.""",ai (phi4),ai (phi4)
15,"What financial support did Darwin receive from the Treasury, and how was this sum adjusted for inflation equivalent to 2021 values?","['=== Overwork, illness, and marriage ===\n\nWhile developing this intensive study of transmutation, Darwin became mired in more work. Still rewriting his Journal, he took on editing and publishing the expert reports on his collections, and with Henslow\'s help obtained a Treasury grant of £1,000 to sponsor this multi-volume Zoology of the Voyage of H.M.S. Beagle, a sum equivalent to about £115,000 in 2021. He stretched the funding to include his planned books on geology, and agreed to unrealistic dates with the publisher. As the Victorian era began, Darwin pressed on with writing his Journal, and in August 1837 began correcting printer\'s proofs.\nAs Darwin worked under pressure, his health suffered. On 20 September, he had ""an uncomfortable palpitation of the heart"", so his doctors urged him to ""knock off all work"" and live in the country for a few weeks. After visiting Shrewsbury, he joined his Wedgwood relatives at Maer Hall, Staffordshire, but found them too eager for tales of his travels to give him much rest. His charming, intelligent, and cultured cousin Emma Wedgwood, nine months older than Darwin, was nursing his invalid aunt. His uncle Josiah pointed out an area of ground where cinders had disappeared under loam and suggested that this might have been the work of earthworms, inspiring ""a new & important theory"" on their role in soil formation, which Darwin presented at the Geological Society on 1 November 1837. His Journal was printed and ready for publication by the end of February 1838, as was the first volume of the Narrative, but FitzRoy was still working hard to finish his own volume.\nWilliam Whewell pushed Darwin to take on the duties of Secretary of the Geological Society. After initially declining the work, he accepted the post in March 1838. Despite the grind of writing and editing the Beagle reports, Darwin made remarkable progress on transmutation, taking every opportunity to question expert naturalists and, unconventionally, people with practical experience in selective breeding such as farmers and pigeon fanciers. Over time, his research drew on information from his relatives and children, the family butler, neighbours, colonists and former shipmates. He included mankind in his speculations from the outset, and on seeing an orangutan in the zoo on 28 March 1838 noted its childlike behaviour.\nThe strain took a toll, and by June he was being laid up for days on end with stomach problems, headaches and heart symptoms. For the rest of his life, he was repeatedly incapacitated with episodes of stomach pains, vomiting, severe boils, palpitations, trembling and other symptoms, particularly during times of stress, such as attending meetings or making social visits. The cause of Darwin\'s illness remained unknown, and attempts at treatment had only ephemeral success.\nOn 23 June, he took a break and went ""geologising"" in Scotland. He visited Glen Roy in glorious weather to see the parallel ""roads"" cut into the hillsides at three heights. He later published his view that these were marine-raised beaches, but then had to accept that they were shorelines of a proglacial lake.\n\nFully recuperated, he returned to Shrewsbury in July 1838. Used to jotting down daily notes on animal breeding, he scrawled rambling thoughts about marriage, career and prospects on two scraps of paper, one with columns headed ""Marry"" and ""Not Marry"". Advantages under ""Marry"" included ""constant companion and a friend in old age ... better than a dog anyhow"", against points such as ""less money for books"" and ""terrible loss of time"". Having decided in favour of marriage, he discussed it with his father, then went to visit his cousin Emma on 29 July. At this time he did not get around to proposing, but against his father\'s advice, he mentioned his ideas on transmutation.\nHe married Emma on 29 January 1839 and they were the parents of ten children, seven of whom survived to adulthood.']","Charles Darwin received a Treasury grant of £1,000 to sponsor the publication of the multi-volume ""Zoology of the Voyage of H.M.S. Beagle."" This amount is equivalent to about £115,000 in 2021 when adjusted for inflation. This financial support helped him manage the extensive work involved in editing and publishing expert reports on his collections from the voyage.",ai (phi4),ai (phi4)
