,query,reference_contexts,reference_answer,reference_answer_by,query_by
0,"How did Charles Darwin's early interest in nature influence his educational path, and what specific field of study did he neglect as a result?","[""Charles Robert Darwin ( DAR-win; 12 February 1809 – 19 April 1882) was an English naturalist, geologist, and biologist, widely known for his contributions to evolutionary biology. His proposition that all species of life have descended from a common ancestor is now generally accepted and considered a fundamental scientific concept. In a joint presentation with Alfred Russel Wallace, he introduced his scientific theory that this branching pattern of evolution resulted from a process he called natural selection, in which the struggle for existence has a similar effect to the artificial selection involved in selective breeding. Darwin has been described as one of the most influential figures in human history and was honoured by burial in Westminster Abbey.\nDarwin's early interest in nature led him to neglect his medical education at the University of Edinburgh; instead, he helped to investigate marine invertebrates. His studies at the University of Cambridge's Christ's College from 1828 to 1831 encouraged his passion for natural science. However, it was his five-year voyage on HMS Beagle from 1831 to 1836 that truly established Darwin as an eminent geologist. The observations and theories he developed during his voyage supported Charles Lyell's concept of gradual geological change. Publication of his journal of the voyage made Darwin famous as a popular author.\nPuzzled by the geographical distribution of wildlife and fossils he collected on the voyage, Darwin began detailed investigations and, in 1838, devised his theory of natural selection. Although he discussed his ideas with several naturalists, he needed time for extensive research, and his geological work had priority. He was writing up his theory in 1858 when Alfred Russel Wallace sent him an essay that described the same idea, prompting the immediate joint submission of both their theories to the Linnean Society of London. Darwin's work established evolutionary descent with modification as the dominant scientific explanation of natural diversification. In 1871, he examined human evolution and sexual selection in The Descent of Man, and Selection in Relation to Sex, followed by The Expression of the Emotions in Man and Animals (1872). His research on plants was published in a series of books, and in his final book, The Formation of Vegetable Mould, through the Actions of Worms (1881), he examined earthworms and their effect on soil.\nDarwin published his theory of evolution with compelling evidence in his 1859 book On the Origin of Species. By the 1870s, the scientific community and a majority of the educated public had accepted evolution as a fact. However, many initially favoured  competing explanations that gave only a minor role to natural selection, and it was not until the emergence of the modern evolutionary synthesis from the 1930s to the 1950s that a broad consensus developed in which natural selection was the basic mechanism of evolution. Darwin's scientific discovery is the unifying theory of the life sciences, explaining the diversity of life.\n\n\n== Biography ==""]","Charles Darwin's early interest in nature significantly influenced his educational path by leading him to neglect his medical education at the University of Edinburgh. Instead of focusing on medicine, Darwin became involved in investigating marine invertebrates, which aligned more closely with his passion for natural science and the study of living organisms.

This shift away from a formal medical education allowed Darwin to pursue interests that would later contribute to his groundbreaking work in evolutionary biology. His fascination with nature continued to grow during his time at the University of Cambridge's Christ's College, where he further developed his interest in natural sciences. This foundation ultimately set him on the path to becoming one of the most influential figures in the field of biology and beyond.",ai (phi4),ai (phi4)
1,Describe the significance of Darwin's five-year voyage on HMS Beagle for his development as an eminent geologist and how it contributed to his later theories.,"[""Charles Robert Darwin ( DAR-win; 12 February 1809 – 19 April 1882) was an English naturalist, geologist, and biologist, widely known for his contributions to evolutionary biology. His proposition that all species of life have descended from a common ancestor is now generally accepted and considered a fundamental scientific concept. In a joint presentation with Alfred Russel Wallace, he introduced his scientific theory that this branching pattern of evolution resulted from a process he called natural selection, in which the struggle for existence has a similar effect to the artificial selection involved in selective breeding. Darwin has been described as one of the most influential figures in human history and was honoured by burial in Westminster Abbey.\nDarwin's early interest in nature led him to neglect his medical education at the University of Edinburgh; instead, he helped to investigate marine invertebrates. His studies at the University of Cambridge's Christ's College from 1828 to 1831 encouraged his passion for natural science. However, it was his five-year voyage on HMS Beagle from 1831 to 1836 that truly established Darwin as an eminent geologist. The observations and theories he developed during his voyage supported Charles Lyell's concept of gradual geological change. Publication of his journal of the voyage made Darwin famous as a popular author.\nPuzzled by the geographical distribution of wildlife and fossils he collected on the voyage, Darwin began detailed investigations and, in 1838, devised his theory of natural selection. Although he discussed his ideas with several naturalists, he needed time for extensive research, and his geological work had priority. He was writing up his theory in 1858 when Alfred Russel Wallace sent him an essay that described the same idea, prompting the immediate joint submission of both their theories to the Linnean Society of London. Darwin's work established evolutionary descent with modification as the dominant scientific explanation of natural diversification. In 1871, he examined human evolution and sexual selection in The Descent of Man, and Selection in Relation to Sex, followed by The Expression of the Emotions in Man and Animals (1872). His research on plants was published in a series of books, and in his final book, The Formation of Vegetable Mould, through the Actions of Worms (1881), he examined earthworms and their effect on soil.\nDarwin published his theory of evolution with compelling evidence in his 1859 book On the Origin of Species. By the 1870s, the scientific community and a majority of the educated public had accepted evolution as a fact. However, many initially favoured  competing explanations that gave only a minor role to natural selection, and it was not until the emergence of the modern evolutionary synthesis from the 1930s to the 1950s that a broad consensus developed in which natural selection was the basic mechanism of evolution. Darwin's scientific discovery is the unifying theory of the life sciences, explaining the diversity of life.\n\n\n== Biography ==""]","Charles Robert Darwin's five-year voyage on HMS Beagle from 1831 to 1836 was a pivotal period in his life, significantly contributing to his development as an eminent geologist and laying the groundwork for his later evolutionary theories. During this expedition, Darwin had the opportunity to explore diverse geographical regions, including South America, the Galápagos Islands, Australia, and various other locales. This extensive travel allowed him to observe a wide range of geological formations, fossil records, and living organisms.

One of the key contributions of the voyage was how it supported Charles Lyell's concept of gradual geological change. Darwin observed rock strata and fossils that suggested long-term processes shaping the Earth's surface, reinforcing the idea that the planet had undergone significant changes over vast periods. These observations were crucial in helping him understand the dynamic nature of the Earth's geology.

The geographical distribution of wildlife and fossils he collected during the voyage puzzled Darwin and prompted detailed investigations into these patterns. This curiosity led to his formulation of the theory of natural selection in 1838, as he sought to explain how species adapted to their environments over time. The diverse specimens and data he gathered provided compelling evidence for evolutionary processes.

Moreover, the voyage established Darwin's reputation as a skilled geologist. His observations and insights were published in his journal of the voyage, which gained him fame as an author and scientist. This recognition allowed him to further explore and develop his ideas on evolution and natural selection, eventually leading to the publication of ""On the Origin of Species"" in 1859.

In summary, Darwin's voyage on HMS Beagle was instrumental in shaping his geological insights and provided the empirical foundation for his revolutionary theories on evolution and natural selection.",ai (phi4),ai (phi4)
2,"What was the impact of Alfred Russel Wallace's essay on Charles Darwin's work, and how did their joint submission influence the scientific community's acceptance of natural selection?","[""Charles Robert Darwin ( DAR-win; 12 February 1809 – 19 April 1882) was an English naturalist, geologist, and biologist, widely known for his contributions to evolutionary biology. His proposition that all species of life have descended from a common ancestor is now generally accepted and considered a fundamental scientific concept. In a joint presentation with Alfred Russel Wallace, he introduced his scientific theory that this branching pattern of evolution resulted from a process he called natural selection, in which the struggle for existence has a similar effect to the artificial selection involved in selective breeding. Darwin has been described as one of the most influential figures in human history and was honoured by burial in Westminster Abbey.\nDarwin's early interest in nature led him to neglect his medical education at the University of Edinburgh; instead, he helped to investigate marine invertebrates. His studies at the University of Cambridge's Christ's College from 1828 to 1831 encouraged his passion for natural science. However, it was his five-year voyage on HMS Beagle from 1831 to 1836 that truly established Darwin as an eminent geologist. The observations and theories he developed during his voyage supported Charles Lyell's concept of gradual geological change. Publication of his journal of the voyage made Darwin famous as a popular author.\nPuzzled by the geographical distribution of wildlife and fossils he collected on the voyage, Darwin began detailed investigations and, in 1838, devised his theory of natural selection. Although he discussed his ideas with several naturalists, he needed time for extensive research, and his geological work had priority. He was writing up his theory in 1858 when Alfred Russel Wallace sent him an essay that described the same idea, prompting the immediate joint submission of both their theories to the Linnean Society of London. Darwin's work established evolutionary descent with modification as the dominant scientific explanation of natural diversification. In 1871, he examined human evolution and sexual selection in The Descent of Man, and Selection in Relation to Sex, followed by The Expression of the Emotions in Man and Animals (1872). His research on plants was published in a series of books, and in his final book, The Formation of Vegetable Mould, through the Actions of Worms (1881), he examined earthworms and their effect on soil.\nDarwin published his theory of evolution with compelling evidence in his 1859 book On the Origin of Species. By the 1870s, the scientific community and a majority of the educated public had accepted evolution as a fact. However, many initially favoured  competing explanations that gave only a minor role to natural selection, and it was not until the emergence of the modern evolutionary synthesis from the 1930s to the 1950s that a broad consensus developed in which natural selection was the basic mechanism of evolution. Darwin's scientific discovery is the unifying theory of the life sciences, explaining the diversity of life.\n\n\n== Biography ==""]","Alfred Russel Wallace's essay had a significant impact on Charles Darwin's work. In 1858, Wallace sent Darwin an essay that described a theory of evolution by natural selection remarkably similar to Darwin's own ideas, which he had been developing for over two decades but had not yet published. This prompted Darwin to expedite his efforts and present his findings.

The joint submission of their theories to the Linnean Society of London in 1858 was crucial because it publicly introduced the concept of natural selection as a mechanism for evolution. Although this initial presentation did not immediately lead to widespread acceptance, it set the stage for Darwin's more comprehensive work.

Darwin published ""On the Origin of Species"" in 1859, where he provided extensive evidence and arguments supporting his theory of evolution by natural selection. This publication was pivotal in influencing the scientific community and educated public. By the 1870s, many had accepted evolution as a fact, though there were competing explanations that minimized the role of natural selection.

The full acceptance of natural selection as the primary mechanism of evolution came with the modern evolutionary synthesis from the 1930s to the 1950s. This period integrated Darwin's theory with genetics and other biological disciplines, leading to a broad consensus in the scientific community about the central role of natural selection in explaining the diversity of life.

In summary, Wallace's essay catalyzed Darwin to publish his work, which eventually led to the widespread acceptance of natural selection as a fundamental principle of evolutionary biology.",ai (phi4),ai (phi4)
3,"Describe the influence of Charles Darwin's family background on his early interest in natural history and evolution, particularly focusing on the roles played by his grandfathers Erasmus Darwin and Josiah Wedgwood.","['== Biography ==\n\n\n=== Early life and education ===\n\nDarwin was born in Shrewsbury, Shropshire, on 12 February 1809, at his family\'s home, The Mount. He was the fifth of six children of wealthy society doctor and financier Robert Darwin and Susannah Darwin (née Wedgwood). His grandfathers Erasmus Darwin and Josiah Wedgwood were both prominent abolitionists. Erasmus Darwin had praised general concepts of evolution and common descent in his Zoonomia (1794), a poetic fantasy of gradual creation including undeveloped ideas anticipating concepts his grandson expanded.\n\nBoth families were largely Unitarian, though the Wedgwoods were adopting Anglicanism. Robert Darwin, a freethinker, had baby Charles baptised in November 1809 in the Anglican St Chad\'s Church, Shrewsbury, but Charles and his siblings attended the local Unitarian Church with their mother. The eight-year-old Charles already had a taste for natural history and collecting when he joined the day school run by its preacher in 1817. That July, his mother died. From September 1818, he joined his older brother Erasmus in attending the nearby Anglican Shrewsbury School as a boarder.\nDarwin spent the summer of 1825 as an apprentice doctor, helping his father treat the poor of Shropshire, before going to the well-regarded University of Edinburgh Medical School with his brother Erasmus in October 1825. Darwin found lectures dull and surgery distressing, so he neglected his studies. He learned taxidermy in around 40 daily hour-long sessions from John Edmonstone, a freed black slave who had accompanied Charles Waterton in the South American rainforest.\nIn Darwin\'s second year at the university, he joined the Plinian Society, a student natural-history group featuring lively debates in which radical democratic students with materialistic views challenged orthodox religious concepts of science. He assisted Robert Edmond Grant\'s investigations of the anatomy and life cycle of marine invertebrates in the Firth of Forth, and on 27 March 1827 presented at the Plinian his own discovery that black spores found in oyster shells were the eggs of a skate leech. One day, Grant praised Lamarck\'s evolutionary ideas. Darwin was astonished by Grant\'s audacity, but had recently read similar ideas in his grandfather Erasmus\' journals. Darwin was rather bored by Robert Jameson\'s natural-history course, which covered geology – including the debate between neptunism and plutonism. He learned the classification of plants and assisted with work on the collections of the University Museum, one of the largest museums in Europe at the time.\nDarwin\'s neglect of medical studies annoyed his father, who sent him to Christ\'s College, Cambridge, in January 1828, to study for a Bachelor of Arts degree as the first step towards becoming an Anglican country parson. Darwin was unqualified for Cambridge\'s Tripos exams and was required instead to join the ordinary degree course. He preferred riding and shooting to studying.\n\nDuring the first few months of Darwin\'s enrolment at Christ\'s College, his second cousin William Darwin Fox was still studying there. Fox impressed him with his butterfly collection, introducing Darwin to entomology and influencing him to pursue beetle collecting. He did this zealously and had some of his finds published in James Francis Stephens\' Illustrations of British entomology (1829–1932).\nThrough Fox, Darwin became a close friend and follower of botany professor John Stevens Henslow. He met other leading parson-naturalists who saw scientific work as religious natural theology, becoming known to these dons as ""the man who walks with Henslow"". When his own exams drew near, Darwin applied himself to his studies and was delighted by the language and logic of William Paley\'s Evidences of Christianity (1795). In his final examination in January 1831, Darwin did well, coming tenth out of 178 candidates for the ordinary degree.\nDarwin had to stay at Cambridge until June 1831. He studied Paley\'s Natural Theology or Evidences of the Existence and Attributes of the Deity (first published in 1802), which made an argument for divine design in nature, explaining adaptation as God acting through laws of nature. He read John Herschel\'s new book, Preliminary Discourse on the Study of Natural Philosophy (1831), which described the highest aim of natural philosophy as understanding such laws through inductive reasoning based on observation, and Alexander von Humboldt\'s Personal Narrative of scientific travels in 1799–1804. Inspired with ""a burning zeal"" to contribute, Darwin planned to visit Tenerife with some classmates after graduation to study natural history in the tropics. In preparation, he joined Adam Sedgwick\'s geology course, then on 4 August travelled with him to spend a fortnight mapping strata in Wales.']","Charles Darwin's family background significantly influenced his early interest in natural history and evolutionary ideas. His grandfather, Erasmus Darwin, was a prominent figure who had already explored general concepts of evolution and common descent in his work ""Zoonomia"" (1794). Although these ideas were not fully developed, they introduced the notion of gradual creation and set a foundation for Charles's later thinking on evolution.

Erasmus Darwin's intellectual legacy provided an early exposure to evolutionary thought within the family. This influence was further reinforced by the fact that Erasmus had documented similar ideas in his journals, which Charles would have encountered during his formative years. The presence of such progressive concepts in his grandfather’s writings likely sparked Charles's curiosity and laid the groundwork for his future scientific inquiries.

Additionally, Darwin's other grandfather, Josiah Wedgwood, was a notable abolitionist and part of a family that valued social reform and intellectual pursuits. Although primarily known for his work as a potter, Josiah's progressive views on society and human rights may have contributed to an environment that encouraged questioning established norms and exploring new ideas.

Both families were largely Unitarian, which often emphasized reason and individual conscience over strict adherence to traditional religious doctrines. This background likely fostered an open-minded approach in Charles Darwin, allowing him to consider scientific theories like evolution without immediate dismissal due to prevailing religious beliefs.

Overall, the intellectual environment created by his grandfathers Erasmus Darwin and Josiah Wedgwood played a crucial role in shaping Charles Darwin's early interest in natural history and evolutionary theory. Their progressive ideas and emphasis on reason provided a fertile ground for his later groundbreaking work in these fields.",ai (phi4),ai (phi4)
