,query,reference_contexts,reference_answer,reference_answer_by,query_by
35,"Describe Charles Darwin's contributions to plant science as detailed in his later works, including his recognition of carnivory in plants and how these findings influenced the field.","['In 1877, Marsh delivered a very influential speech before the annual meeting of the American Association for the Advancement of Science, providing a demonstrative argument for evolution.  For the first time, Marsh traced the evolution of vertebrates from fish all the way through humans.  Sparing no detail, he listed a wealth of fossil examples of past life forms.  The significance of this speech was immediately recognized by the scientific community, and it was printed in its entirety in several scientific journals.\n\n\n=== Descent of Man, sexual selection, and botany ===\n\nDespite repeated bouts of illness during the last twenty-two years of his life, Darwin\'s work continued. Having published On the Origin of Species as an abstract of his theory, he pressed on with experiments, research, and writing of his ""big book"". He covered human descent from earlier animals, including the evolution of society and of mental abilities, as well as explaining decorative beauty in wildlife and diversifying into innovative plant studies.\nEnquiries about insect pollination led in 1861 to novel studies of wild orchids, showing adaptation of their flowers to attract specific moths to each species and ensure cross fertilisation. In 1862, Fertilisation of Orchids gave his first detailed demonstration of the power of natural selection to explain complex ecological relationships, making testable predictions. As his health declined, he lay on his sickbed in a room filled with inventive experiments to trace the movements of climbing plants. Admiring visitors included Ernst Haeckel, a zealous proponent of Darwinism incorporating Lamarckism and Goethe\'s idealism. Wallace remained supportive, though he increasingly turned to Spiritualism.\nDarwin\'s book The Variation of Animals and Plants Under Domestication (1868) was the first part of his planned ""big book"", and included his unsuccessful hypothesis of pangenesis attempting to explain heredity. It sold briskly at first, despite its size, and was translated into many languages. He wrote most of a second part, on natural selection, but it remained unpublished in his lifetime.\nLyell had already popularised human prehistory, and Huxley had shown that anatomically humans are apes. With The Descent of Man, and Selection in Relation to Sex published in 1871, Darwin set out evidence from numerous sources that humans are animals, showing continuity of physical and mental attributes, and presented sexual selection to explain impractical animal features such as the peacock\'s plumage as well as human evolution of culture, differences between sexes, and physical and cultural racial classification, while emphasising that humans are all one species. According to an editorial in Nature journal: ""Although Charles Darwin opposed slavery and proposed that humans have a common ancestor, he also advocated a hierarchy of races, with white people higher than others.""\n\nHis research using images was expanded in his 1872 book The Expression of the Emotions in Man and Animals, one of the first books to feature printed photographs, which discussed the evolution of human psychology and its continuity with the behaviour of animals. Both books proved very popular, and Darwin was impressed by the general assent with which his views had been received, remarking that ""everybody is talking about it without being shocked."" His conclusion was ""that man with all his noble qualities, with sympathy which feels for the most debased, with benevolence which extends not only to other men but to the humblest living creature, with his god-like intellect which has penetrated into the movements and constitution of the solar system – with all these exalted powers – Man still bears in his bodily frame the indelible stamp of his lowly origin.""\nHis evolution-related experiments and investigations led to books on Insectivorous Plants, The Effects of Cross and Self Fertilisation in the Vegetable Kingdom, different forms of flowers on plants of the same species, and The Power of Movement in Plants. He continued to collect information and exchange views from scientific correspondents all over the world, including Mary Treat, whom he encouraged to persevere in her scientific work. He was the first person to recognise the significance of carnivory in plants. His botanical work[IX] was interpreted and popularised by various writers including Grant Allen and H. G. Wells, and helped transform plant science in the late 19th century and early 20th century.']","Charles Darwin made significant contributions to plant science through a series of investigations and publications that explored various aspects of botany. In his later years, despite declining health, he continued to conduct experiments and research on plant behavior and adaptation.

One of Darwin's notable contributions was his recognition of carnivory in plants. He was the first person to recognize the significance of this phenomenon, which involves certain plants capturing and digesting insects as a means of obtaining nutrients. This discovery expanded the understanding of plant adaptations and survival strategies beyond traditional photosynthesis-based nutrition.

Darwin's work on plant science is encapsulated in several key publications:

1. **Insectivorous Plants (1875)**: In this book, Darwin detailed his experiments with carnivorous plants like the Venus flytrap and sundews. He explored how these plants capture prey using specialized structures and mechanisms, providing insights into their evolutionary adaptations.

2. **The Effects of Cross and Self Fertilisation in the Vegetable Kingdom (1876)**: This work examined the advantages and disadvantages of cross-fertilization versus self-fertilization in plants. Darwin's experiments demonstrated that cross-fertilization generally leads to more vigorous offspring, contributing to the understanding of plant reproduction.

3. **Different Forms of Flowers on Plants of the Same Species (1877)**: Here, Darwin investigated how different flower forms within a single species can influence pollination strategies and reproductive success, highlighting the diversity and adaptability in plant evolution.

4. **The Power of Movement in Plants (1880)**: This book explored various movements in plants, such as phototropism and gravitropism, demonstrating that plants are responsive to environmental stimuli in complex ways.

Darwin's botanical research was influential in transforming plant science during the late 19th and early 20th centuries. His findings were interpreted and popularized by writers like Grant Allen and H.G. Wells, which helped disseminate his ideas more broadly. Darwin's work laid foundational concepts for understanding plant behavior, adaptation, and evolution, influencing subsequent research and expanding the scientific community's appreciation of plants as dynamic organisms with complex interactions within their ecosystems.",ai (phi4),ai (phi4)
36,"What were Charles Darwin's last words, and how did he express his feelings about death?","['=== Death and funeral ===\n\nIn 1882, he was diagnosed with what was called ""angina pectoris"" which then meant coronary thrombosis and disease of the heart. At the time of his death, the physicians diagnosed ""anginal attacks"", and ""heart-failure""; there has since been scholarly speculation about his life-long health issues.\nHe died at Down House on 19 April 1882. His last words were to his family, telling Emma, ""I am not the least afraid of death—Remember what a good wife you have been to me—Tell all my children to remember how good they have been to me"". While she rested, he repeatedly told Henrietta and Francis, ""It\'s almost worthwhile to be sick to be nursed by you"".\nHe had expected to be buried in St Mary\'s churchyard at Downe, but at the request of Darwin\'s colleagues, after public and parliamentary petitioning, William Spottiswoode (President of the Royal Society) arranged for Darwin to be honoured by burial in Westminster Abbey, close to John Herschel and Isaac Newton. The funeral, held on Wednesday 26 April, was attended by thousands of people, including family, friends, scientists, philosophers and dignitaries.\n\n\n== Children ==\n\nThe Darwins had ten children: two died in infancy, and Annie\'s death at the age of ten had a devastating effect on her parents. Charles was a devoted father and uncommonly attentive to his children. Whenever they fell ill, he feared that they might have inherited weaknesses from inbreeding due to the close family ties he shared with his wife and cousin, Emma Wedgwood. He examined inbreeding in his writings, contrasting it with the advantages of outcrossing in many species.\n\nCharles Waring Darwin, born in December 1856, was the tenth and last of the children. Emma Darwin was aged 48 at the time of the birth, and the child was mentally subnormal and never learnt to walk or talk. He probably had Down syndrome, which had not then been medically described. The evidence is a photograph by William Erasmus Darwin of the infant and his mother, showing a characteristic head shape, and the family\'s observations of the child. Charles Waring died of scarlet fever on 28 June 1858, when Darwin wrote in his journal: ""Poor dear Baby died."" \nOf his surviving children, George, Francis and Horace became Fellows of the Royal Society, distinguished as an astronomer, botanist and civil engineer, respectively. All three were knighted. Another son, Leonard, went on to be a soldier, politician, economist, eugenicist, and mentor of the statistician and evolutionary biologist Ronald Fisher.\n\n\n== Views and opinions ==']","Charles Darwin's last words to his family expressed a calm acceptance of death. He told Emma, ""I am not the least afraid of death—Remember what a good wife you have been to me—Tell all my children to remember how good they have been to me."" This indicates that he felt at peace with the idea of dying and wanted to acknowledge the support and kindness his family had shown him. Additionally, while resting, he repeatedly told Henrietta and Francis, ""It's almost worthwhile to be sick to be nursed by you,"" suggesting a sense of gratitude for their care during his illness. Overall, Darwin expressed no fear of death and conveyed appreciation for his family's love and support.",ai (phi4),ai (phi4)
37,Describe the circumstances surrounding the burial of Charles Darwin and explain why it was significant.,"['=== Death and funeral ===\n\nIn 1882, he was diagnosed with what was called ""angina pectoris"" which then meant coronary thrombosis and disease of the heart. At the time of his death, the physicians diagnosed ""anginal attacks"", and ""heart-failure""; there has since been scholarly speculation about his life-long health issues.\nHe died at Down House on 19 April 1882. His last words were to his family, telling Emma, ""I am not the least afraid of death—Remember what a good wife you have been to me—Tell all my children to remember how good they have been to me"". While she rested, he repeatedly told Henrietta and Francis, ""It\'s almost worthwhile to be sick to be nursed by you"".\nHe had expected to be buried in St Mary\'s churchyard at Downe, but at the request of Darwin\'s colleagues, after public and parliamentary petitioning, William Spottiswoode (President of the Royal Society) arranged for Darwin to be honoured by burial in Westminster Abbey, close to John Herschel and Isaac Newton. The funeral, held on Wednesday 26 April, was attended by thousands of people, including family, friends, scientists, philosophers and dignitaries.\n\n\n== Children ==\n\nThe Darwins had ten children: two died in infancy, and Annie\'s death at the age of ten had a devastating effect on her parents. Charles was a devoted father and uncommonly attentive to his children. Whenever they fell ill, he feared that they might have inherited weaknesses from inbreeding due to the close family ties he shared with his wife and cousin, Emma Wedgwood. He examined inbreeding in his writings, contrasting it with the advantages of outcrossing in many species.\n\nCharles Waring Darwin, born in December 1856, was the tenth and last of the children. Emma Darwin was aged 48 at the time of the birth, and the child was mentally subnormal and never learnt to walk or talk. He probably had Down syndrome, which had not then been medically described. The evidence is a photograph by William Erasmus Darwin of the infant and his mother, showing a characteristic head shape, and the family\'s observations of the child. Charles Waring died of scarlet fever on 28 June 1858, when Darwin wrote in his journal: ""Poor dear Baby died."" \nOf his surviving children, George, Francis and Horace became Fellows of the Royal Society, distinguished as an astronomer, botanist and civil engineer, respectively. All three were knighted. Another son, Leonard, went on to be a soldier, politician, economist, eugenicist, and mentor of the statistician and evolutionary biologist Ronald Fisher.\n\n\n== Views and opinions ==']","Charles Darwin's burial was a notable event due to its location and the process leading up to it. Initially, Darwin had expected to be buried in St Mary's churchyard at Downe, near his home, Down House. However, following public and parliamentary petitioning, significant figures such as William Spottiswoode, President of the Royal Society, arranged for him to be honored with a burial in Westminster Abbey. This decision placed Darwin close to other eminent scientists like John Herschel and Isaac Newton.

The significance of this burial lies in its recognition of Darwin's monumental contributions to science, particularly his work on evolution through natural selection. Being interred in Westminster Abbey, a site reserved for individuals who have made substantial impacts in various fields, underscored the high regard in which he was held by both the scientific community and society at large. The funeral itself attracted thousands of attendees, including family, friends, scientists, philosophers, and dignitaries, reflecting the widespread influence and respect Darwin commanded.

This burial not only honored his legacy but also symbolized the acceptance and celebration of his groundbreaking ideas that had reshaped biological sciences and influenced a wide range of disciplines.",ai (phi4),ai (phi4)
38,Discuss the impact of Annie Darwin's death on her parents and how Charles Darwin viewed the health issues of his children in relation to their family background.,"['=== Death and funeral ===\n\nIn 1882, he was diagnosed with what was called ""angina pectoris"" which then meant coronary thrombosis and disease of the heart. At the time of his death, the physicians diagnosed ""anginal attacks"", and ""heart-failure""; there has since been scholarly speculation about his life-long health issues.\nHe died at Down House on 19 April 1882. His last words were to his family, telling Emma, ""I am not the least afraid of death—Remember what a good wife you have been to me—Tell all my children to remember how good they have been to me"". While she rested, he repeatedly told Henrietta and Francis, ""It\'s almost worthwhile to be sick to be nursed by you"".\nHe had expected to be buried in St Mary\'s churchyard at Downe, but at the request of Darwin\'s colleagues, after public and parliamentary petitioning, William Spottiswoode (President of the Royal Society) arranged for Darwin to be honoured by burial in Westminster Abbey, close to John Herschel and Isaac Newton. The funeral, held on Wednesday 26 April, was attended by thousands of people, including family, friends, scientists, philosophers and dignitaries.\n\n\n== Children ==\n\nThe Darwins had ten children: two died in infancy, and Annie\'s death at the age of ten had a devastating effect on her parents. Charles was a devoted father and uncommonly attentive to his children. Whenever they fell ill, he feared that they might have inherited weaknesses from inbreeding due to the close family ties he shared with his wife and cousin, Emma Wedgwood. He examined inbreeding in his writings, contrasting it with the advantages of outcrossing in many species.\n\nCharles Waring Darwin, born in December 1856, was the tenth and last of the children. Emma Darwin was aged 48 at the time of the birth, and the child was mentally subnormal and never learnt to walk or talk. He probably had Down syndrome, which had not then been medically described. The evidence is a photograph by William Erasmus Darwin of the infant and his mother, showing a characteristic head shape, and the family\'s observations of the child. Charles Waring died of scarlet fever on 28 June 1858, when Darwin wrote in his journal: ""Poor dear Baby died."" \nOf his surviving children, George, Francis and Horace became Fellows of the Royal Society, distinguished as an astronomer, botanist and civil engineer, respectively. All three were knighted. Another son, Leonard, went on to be a soldier, politician, economist, eugenicist, and mentor of the statistician and evolutionary biologist Ronald Fisher.\n\n\n== Views and opinions ==']","Annie Darwin's death had a profound and devastating effect on her parents, Charles and Emma Darwin. As one of their surviving children after two infant deaths, Annie was deeply cherished by her family. Her passing at the age of ten left both parents heartbroken, highlighting the emotional toll that the loss of a child can have on parents.

Charles Darwin's concern for his children's health extended beyond personal grief; he was acutely aware of potential genetic issues within their family. He feared that his children might inherit weaknesses due to inbreeding, as Emma Wedgwood, his wife and cousin, shared close family ties with him. This concern is evident in his writings where he examined the effects of inbreeding versus outcrossing in various species. Darwin's scientific curiosity about heredity was intertwined with personal anxiety over his children's well-being.

The death of their son Charles Waring Darwin further exemplified these concerns. Born when Emma was 48, Charles Waring exhibited signs that are now associated with Down syndrome, such as a characteristic head shape and developmental delays in walking and talking. Although the medical understanding at the time did not identify his condition as Down syndrome, the family's observations and a photograph by William Erasmus Darwin suggested these traits.

Overall, Annie's death deeply affected Charles and Emma Darwin emotionally, while their experiences with their children's health issues fueled Charles's scientific inquiries into heredity and inbreeding. These personal challenges influenced both his emotional life and professional work, underscoring the intersection of family dynamics and scientific exploration in Darwin's life.",ai (phi4),ai (phi4)
39,"How did Charles Darwin's religious views evolve from his time at Cambridge to after his return from the HMS Beagle voyage, and what factors influenced this change?","['== Views and opinions ==\n\n\n=== Religious views ===\n\nDarwin\'s family tradition was nonconformist Unitarianism, while his father and grandfather were freethinkers, and his baptism and boarding school were Church of England. When going to Cambridge to become an Anglican clergyman, he did not ""in the least doubt the strict and literal truth of every word in the Bible"". He learned John Herschel\'s science which, like William Paley\'s natural theology, sought explanations in laws of nature rather than miracles and saw adaptation of species as evidence of design. On board HMS Beagle, Darwin was quite orthodox and would quote the Bible as an authority on morality. He looked for ""centres of creation"" to explain distribution, and suggested that the very similar antlions found in Australia and England were evidence of a divine hand.\n\nUpon his return, he expressed a critical view of the Bible\'s historical accuracy and questioned the basis for considering one religion more valid than another. In the next few years, while intensively speculating on geology and the transmutation of species, he gave much thought to religion and openly discussed this with his wife Emma, whose beliefs similarly came from intensive study and questioning.\nThe theodicy of Paley and Thomas Malthus vindicated evils such as starvation as a result of a benevolent creator\'s laws, which had an overall good effect. To Darwin, natural selection produced the good of adaptation but removed the need for design, and he could not see the work of an omnipotent deity in all the pain and suffering, such as the ichneumon wasp paralysing caterpillars as live food for its eggs. Though he thought of religion as a tribal survival strategy, Darwin was reluctant to give up the idea of God as an ultimate lawgiver. He was increasingly troubled by the problem of evil.\nDarwin remained close friends with the vicar of Downe, John Brodie Innes, and continued to play a leading part in the parish work of the church, but from c.\u20091849 would go for a walk on Sundays while his family attended church. He considered it ""absurd to doubt that a man might be an ardent theist and an evolutionist"" and, though reticent about his religious views, in 1879 he wrote that ""I have never been an atheist in the sense of denying the existence of a God. – I think that generally ... an agnostic would be the most correct description of my state of mind"".\nThe ""Lady Hope Story"", published in 1915, claimed that Darwin had reverted to Christianity on his sickbed. The claims were repudiated by Darwin\'s children and have been dismissed as false by historians.']","Charles Darwin's religious views underwent significant evolution from his time at Cambridge to after his return from the HMS Beagle voyage. Initially, when he went to Cambridge with the intention of becoming an Anglican clergyman, Darwin was quite orthodox in his beliefs. He did not doubt ""the strict and literal truth of every word in the Bible"" and saw adaptation as evidence of divine design, aligning with natural theology perspectives like those of William Paley.

However, upon returning from the HMS Beagle voyage, several factors influenced a shift in his religious views:

1. **Scientific Observations**: During the voyage, Darwin collected extensive data on species distribution and adaptation. His observations led him to question literal interpretations of the Bible, particularly regarding its historical accuracy.

2. **Speculation on Geology and Species Transmutation**: In the years following his return, Darwin engaged deeply with geological studies and the idea of species transmutation (evolution). This intellectual pursuit prompted him to reconsider religious explanations for natural phenomena.

3. **Critical Examination of Religion**: Darwin began to critically evaluate the basis for considering one religion more valid than another, reflecting a broader questioning of traditional religious beliefs.

4. **The Problem of Evil**: Influenced by thinkers like Paley and Malthus, Darwin grappled with theodicy—the justification of evil in a world governed by a benevolent deity. He found it difficult to reconcile natural selection's role in adaptation with the existence of suffering and pain, such as that caused by parasitic wasps.

5. **Personal Reflections**: Darwin discussed his evolving views on religion with his wife Emma, whose beliefs also stemmed from intensive study and questioning. This personal dialogue likely contributed to his changing perspective.

By around 1849, Darwin's religious practices had changed; he would take walks on Sundays while his family attended church. Although he remained a theist in some respects, describing himself as an ""agnostic"" by 1879, he distanced himself from orthodox Christianity and struggled with traditional concepts of divine design and omnipotence.

Overall, Darwin's shift was influenced by his scientific discoveries, critical thinking about religion, and personal reflections on morality and suffering.",ai (phi4),ai (phi4)
