,query,reference_contexts,reference_answer,reference_answer_by,query_by
0,"In which year did John Stevens Henslow graduate as the 16th wrangler from St. John's College, Cambridge?","[""John Stevens Henslow (6 February 1796 – 16 May 1861) was an English Anglican priest, botanist and geologist. He is best remembered as friend and mentor to Charles Darwin.\n\n\n== Early life ==\nHenslow was born at Rochester, Kent, the son of a solicitor John Prentis Henslow, who was the son of John Henslow.\nHenslow was educated at St. John's College, Cambridge where he graduated as 16th wrangler in 1818, the year in which Adam Sedgwick became Woodwardian Professor of Geology.""]","John Stevens Henslow graduated as the 16th wrangler in 1818 from St. John's College, Cambridge.",ai (phi4),ai (phi4)
1,Who was appointed as Woodwardian Professor of Geology at the same time John Stevens Henslow graduated in 1818?,"[""John Stevens Henslow (6 February 1796 – 16 May 1861) was an English Anglican priest, botanist and geologist. He is best remembered as friend and mentor to Charles Darwin.\n\n\n== Early life ==\nHenslow was born at Rochester, Kent, the son of a solicitor John Prentis Henslow, who was the son of John Henslow.\nHenslow was educated at St. John's College, Cambridge where he graduated as 16th wrangler in 1818, the year in which Adam Sedgwick became Woodwardian Professor of Geology.""]",Adam Sedgwick was appointed as Woodwardian Professor of Geology at the same time John Stevens Henslow graduated in 1818.,ai (phi4),ai (phi4)
2,"What professions is John Stevens Henslow best known for, and who did he mentor?","[""John Stevens Henslow (6 February 1796 – 16 May 1861) was an English Anglican priest, botanist and geologist. He is best remembered as friend and mentor to Charles Darwin.\n\n\n== Early life ==\nHenslow was born at Rochester, Kent, the son of a solicitor John Prentis Henslow, who was the son of John Henslow.\nHenslow was educated at St. John's College, Cambridge where he graduated as 16th wrangler in 1818, the year in which Adam Sedgwick became Woodwardian Professor of Geology.""]","John Stevens Henslow is best known as an Anglican priest, botanist, and geologist. He mentored Charles Darwin.",ai (phi4),ai (phi4)
3,"What role did John Stevens Henslow play in Charles Darwin's career, and how did he influence Darwin's work on evolution?","['John Stevens Henslow (6 February 1796 – 16 May 1861) was an English Anglican priest, botanist and geologist. He is best remembered as friend and mentor to Charles Darwin.\n\n\n== Early life ==\nHenslow was born at Rochester, Kent, the son of a solicitor John Prentis Henslow, who was the son of John Henslow.\nHenslow was educated at St. John\'s College, Cambridge where he graduated as 16th wrangler in 1818, the year in which Adam Sedgwick became Woodwardian Professor of Geology.\n\n\n== Early career ==\nHenslow graduated in 1818. He already had a passion for natural history from his childhood, which largely influenced his career, and he accompanied Sedgwick in 1819 on a tour in the Isle of Wight where he learned his first lessons in geology. He also studied chemistry under Professor James Cumming and mineralogy under Edward Daniel Clarke. In the autumn of 1819 he made valuable observations on the geology of the Isle of Man (Trans. Geol. Soc., 1821) and in 1820 and 1821 he investigated the geology of parts of Anglesey, the results being printed in the first volume of the Transactions of the Cambridge Philosophical Society (1822). The Philosophical Society was founded in November 1819 by a group at Cambridge with Professors Farish, Lee, and Sedgwick and Henslow (at that time not yet a professor). The idea and initial impetus for the society originated from Sedgwick and Henslow.\nMeanwhile, Henslow had studied mineralogy with considerable zeal, so that on the death of Clarke he was in 1822 appointed professor of mineralogy in the University of Cambridge. Two years later he took holy orders. Botany, however, had claimed much of his attention, and to this science he became more and more attached, so that he gladly resigned the chair of mineralogy in 1827, two years after becoming professor of botany. As a teacher both in the classroom and in the field he was eminently successful. He was a correspondent of John James Audubon who in 1829 named Henslow\'s sparrow (Centronyx henslowii) after him.\nFrom 1821 Henslow had begun organising a herbarium of British flora, supplementing his own collecting with a network which expanded over time to include his friends and family, and the botanists William Jackson Hooker and John Hutton Balfour, as well as about 30 of his students. As a mineralogist he had used Haüy\'s laws of crystallography to analyse complex crystals as transformations of ""the primitive form of the species"" of crystal, and when he moved to botany in 1825 he sought similarly precise laws to group plant varieties into species, often including as varieties plants that respected taxonomists had ranked as separate species. He followed the understanding of the time that species were fixed as created but could vary within limits, and hoped to analyse these limits of variation. By a method he called ""collation"", Henslow prepared sheets with several plant specimens, each labelled with the collector, date and place of collection, comparing the specimens to show the variation within the species. His A Catalogue of British Plants was first published in October 1829, and became a set book for his lecture course.\nHenslow is remembered as friend and mentor to his pupil Charles Darwin, and for inspiring him with a passion for natural history. The two met in 1828. Earlier that year, Darwin joined the course and along with other students helped to collect plants of Cambridgeshire. Henslow became his tutor, and it was not long before he marked out Darwin as a promising student. In 1830 Henslow experimented on varying the conditions of garden grown wild plants to produce various forms of the plant. In 1835 Henslow published Principles of Descriptive and Physiological Botany as a textbook based on this lecture course.\nIn the summer of 1831 Henslow was offered a place as naturalist to sail aboard the survey ship HMS Beagle on a two-year voyage to survey South America, but his wife dissuaded him from accepting. Seeing a perfect opportunity for his protégé, Henslow wrote to the ship\'s captain Robert Fitzroy telling him that Darwin was the ideal man to join the expedition team. During the voyage, Darwin corresponded with Henslow, and collected plants with him in mind. In particular, when first arriving at the Galápagos Islands Darwin noted ""I certainly recognize S America in Ornithology, would a botanist?"", and went on to collect plant specimens carefully labelled by island and date. He also labelled the mockingbirds he caught, and initially thought these were varieties but while arranging these bird specimens on the last lap of the voyage he began wondering if they could be species, a possibility which would ""undermine the stability of Species"". Henslow\'s teaching continued to influence Darwin\'s work on evolution.\nBesides Darwin, other famous students of Henslow included Miles Joseph Berkeley, Cardale Babington, Leonard Jenyns, Richard Thomas Lowe and William Hallowes Miller.']","John Stevens Henslow played a pivotal role as both a mentor and friend to Charles Darwin, significantly influencing his career and work on evolution. Their relationship began when they met in 1828 at the University of Cambridge, where Henslow was teaching botany. Recognizing Darwin's potential early on, Henslow marked him out as a promising student.

Henslow's influence extended beyond formal education; he inspired Darwin with a passion for natural history and provided guidance that shaped his scientific pursuits. One of Henslow’s most significant contributions to Darwin's career was recommending him for the position of naturalist aboard HMS Beagle, despite Henslow himself being offered the role. This recommendation led to Darwin embarking on the two-year voyage around South America, which became crucial in developing his ideas about evolution.

During the voyage, Darwin maintained correspondence with Henslow and collected plant specimens with Henslow's expertise in mind. The observations and collections made during this journey, particularly at the Galápagos Islands, were instrumental in shaping Darwin’s thoughts on species variation and natural selection. Henslow's teachings continued to influence Darwin as he began questioning the stability of species based on his findings.

Overall, Henslow's mentorship provided Darwin with both scientific knowledge and opportunities that were critical in formulating his groundbreaking theories on evolution.",ai (phi4),ai (phi4)
4,"Describe the contributions of John Stevens Henslow to botany, particularly his method called ""collation"" and its purpose.","['John Stevens Henslow (6 February 1796 – 16 May 1861) was an English Anglican priest, botanist and geologist. He is best remembered as friend and mentor to Charles Darwin.\n\n\n== Early life ==\nHenslow was born at Rochester, Kent, the son of a solicitor John Prentis Henslow, who was the son of John Henslow.\nHenslow was educated at St. John\'s College, Cambridge where he graduated as 16th wrangler in 1818, the year in which Adam Sedgwick became Woodwardian Professor of Geology.\n\n\n== Early career ==\nHenslow graduated in 1818. He already had a passion for natural history from his childhood, which largely influenced his career, and he accompanied Sedgwick in 1819 on a tour in the Isle of Wight where he learned his first lessons in geology. He also studied chemistry under Professor James Cumming and mineralogy under Edward Daniel Clarke. In the autumn of 1819 he made valuable observations on the geology of the Isle of Man (Trans. Geol. Soc., 1821) and in 1820 and 1821 he investigated the geology of parts of Anglesey, the results being printed in the first volume of the Transactions of the Cambridge Philosophical Society (1822). The Philosophical Society was founded in November 1819 by a group at Cambridge with Professors Farish, Lee, and Sedgwick and Henslow (at that time not yet a professor). The idea and initial impetus for the society originated from Sedgwick and Henslow.\nMeanwhile, Henslow had studied mineralogy with considerable zeal, so that on the death of Clarke he was in 1822 appointed professor of mineralogy in the University of Cambridge. Two years later he took holy orders. Botany, however, had claimed much of his attention, and to this science he became more and more attached, so that he gladly resigned the chair of mineralogy in 1827, two years after becoming professor of botany. As a teacher both in the classroom and in the field he was eminently successful. He was a correspondent of John James Audubon who in 1829 named Henslow\'s sparrow (Centronyx henslowii) after him.\nFrom 1821 Henslow had begun organising a herbarium of British flora, supplementing his own collecting with a network which expanded over time to include his friends and family, and the botanists William Jackson Hooker and John Hutton Balfour, as well as about 30 of his students. As a mineralogist he had used Haüy\'s laws of crystallography to analyse complex crystals as transformations of ""the primitive form of the species"" of crystal, and when he moved to botany in 1825 he sought similarly precise laws to group plant varieties into species, often including as varieties plants that respected taxonomists had ranked as separate species. He followed the understanding of the time that species were fixed as created but could vary within limits, and hoped to analyse these limits of variation. By a method he called ""collation"", Henslow prepared sheets with several plant specimens, each labelled with the collector, date and place of collection, comparing the specimens to show the variation within the species. His A Catalogue of British Plants was first published in October 1829, and became a set book for his lecture course.\nHenslow is remembered as friend and mentor to his pupil Charles Darwin, and for inspiring him with a passion for natural history. The two met in 1828. Earlier that year, Darwin joined the course and along with other students helped to collect plants of Cambridgeshire. Henslow became his tutor, and it was not long before he marked out Darwin as a promising student. In 1830 Henslow experimented on varying the conditions of garden grown wild plants to produce various forms of the plant. In 1835 Henslow published Principles of Descriptive and Physiological Botany as a textbook based on this lecture course.\nIn the summer of 1831 Henslow was offered a place as naturalist to sail aboard the survey ship HMS Beagle on a two-year voyage to survey South America, but his wife dissuaded him from accepting. Seeing a perfect opportunity for his protégé, Henslow wrote to the ship\'s captain Robert Fitzroy telling him that Darwin was the ideal man to join the expedition team. During the voyage, Darwin corresponded with Henslow, and collected plants with him in mind. In particular, when first arriving at the Galápagos Islands Darwin noted ""I certainly recognize S America in Ornithology, would a botanist?"", and went on to collect plant specimens carefully labelled by island and date. He also labelled the mockingbirds he caught, and initially thought these were varieties but while arranging these bird specimens on the last lap of the voyage he began wondering if they could be species, a possibility which would ""undermine the stability of Species"". Henslow\'s teaching continued to influence Darwin\'s work on evolution.\nBesides Darwin, other famous students of Henslow included Miles Joseph Berkeley, Cardale Babington, Leonard Jenyns, Richard Thomas Lowe and William Hallowes Miller.']","John Stevens Henslow made significant contributions to botany through both his teaching methods and scientific approaches. One notable contribution was his development of a method known as ""collation."" This method involved preparing sheets with multiple specimens of the same plant species, each labeled with details such as the collector's name, date, and place of collection. The purpose of collation was to systematically compare these specimens to observe variations within a species.

Henslow aimed to analyze the limits of variation within species by using this method. At the time, it was generally understood that species were fixed entities created with certain inherent variability. Henslow's approach sought to identify and categorize these variations precisely, often including plants that other taxonomists might have classified as separate species.

Through collation, Henslow hoped to establish more precise laws for grouping plant varieties into species, similar to how he had previously applied Haüy's laws of crystallography in mineralogy. This method not only contributed to the scientific understanding of botanical classification but also influenced his students, including Charles Darwin, who later developed groundbreaking ideas on evolution.

Additionally, Henslow's work extended beyond collation; he organized a herbarium of British flora and published ""A Catalogue of British Plants"" in 1829. This publication became an essential resource for his lecture course and further established his influence in the field of botany.",ai (phi4),ai (phi4)
5,How did John Stevens Henslow's early education and career choices reflect his passion for natural history? Include details about his studies and professional appointments.,"['John Stevens Henslow (6 February 1796 – 16 May 1861) was an English Anglican priest, botanist and geologist. He is best remembered as friend and mentor to Charles Darwin.\n\n\n== Early life ==\nHenslow was born at Rochester, Kent, the son of a solicitor John Prentis Henslow, who was the son of John Henslow.\nHenslow was educated at St. John\'s College, Cambridge where he graduated as 16th wrangler in 1818, the year in which Adam Sedgwick became Woodwardian Professor of Geology.\n\n\n== Early career ==\nHenslow graduated in 1818. He already had a passion for natural history from his childhood, which largely influenced his career, and he accompanied Sedgwick in 1819 on a tour in the Isle of Wight where he learned his first lessons in geology. He also studied chemistry under Professor James Cumming and mineralogy under Edward Daniel Clarke. In the autumn of 1819 he made valuable observations on the geology of the Isle of Man (Trans. Geol. Soc., 1821) and in 1820 and 1821 he investigated the geology of parts of Anglesey, the results being printed in the first volume of the Transactions of the Cambridge Philosophical Society (1822). The Philosophical Society was founded in November 1819 by a group at Cambridge with Professors Farish, Lee, and Sedgwick and Henslow (at that time not yet a professor). The idea and initial impetus for the society originated from Sedgwick and Henslow.\nMeanwhile, Henslow had studied mineralogy with considerable zeal, so that on the death of Clarke he was in 1822 appointed professor of mineralogy in the University of Cambridge. Two years later he took holy orders. Botany, however, had claimed much of his attention, and to this science he became more and more attached, so that he gladly resigned the chair of mineralogy in 1827, two years after becoming professor of botany. As a teacher both in the classroom and in the field he was eminently successful. He was a correspondent of John James Audubon who in 1829 named Henslow\'s sparrow (Centronyx henslowii) after him.\nFrom 1821 Henslow had begun organising a herbarium of British flora, supplementing his own collecting with a network which expanded over time to include his friends and family, and the botanists William Jackson Hooker and John Hutton Balfour, as well as about 30 of his students. As a mineralogist he had used Haüy\'s laws of crystallography to analyse complex crystals as transformations of ""the primitive form of the species"" of crystal, and when he moved to botany in 1825 he sought similarly precise laws to group plant varieties into species, often including as varieties plants that respected taxonomists had ranked as separate species. He followed the understanding of the time that species were fixed as created but could vary within limits, and hoped to analyse these limits of variation. By a method he called ""collation"", Henslow prepared sheets with several plant specimens, each labelled with the collector, date and place of collection, comparing the specimens to show the variation within the species. His A Catalogue of British Plants was first published in October 1829, and became a set book for his lecture course.\nHenslow is remembered as friend and mentor to his pupil Charles Darwin, and for inspiring him with a passion for natural history. The two met in 1828. Earlier that year, Darwin joined the course and along with other students helped to collect plants of Cambridgeshire. Henslow became his tutor, and it was not long before he marked out Darwin as a promising student. In 1830 Henslow experimented on varying the conditions of garden grown wild plants to produce various forms of the plant. In 1835 Henslow published Principles of Descriptive and Physiological Botany as a textbook based on this lecture course.\nIn the summer of 1831 Henslow was offered a place as naturalist to sail aboard the survey ship HMS Beagle on a two-year voyage to survey South America, but his wife dissuaded him from accepting. Seeing a perfect opportunity for his protégé, Henslow wrote to the ship\'s captain Robert Fitzroy telling him that Darwin was the ideal man to join the expedition team. During the voyage, Darwin corresponded with Henslow, and collected plants with him in mind. In particular, when first arriving at the Galápagos Islands Darwin noted ""I certainly recognize S America in Ornithology, would a botanist?"", and went on to collect plant specimens carefully labelled by island and date. He also labelled the mockingbirds he caught, and initially thought these were varieties but while arranging these bird specimens on the last lap of the voyage he began wondering if they could be species, a possibility which would ""undermine the stability of Species"". Henslow\'s teaching continued to influence Darwin\'s work on evolution.\nBesides Darwin, other famous students of Henslow included Miles Joseph Berkeley, Cardale Babington, Leonard Jenyns, Richard Thomas Lowe and William Hallowes Miller.']","John Stevens Henslow's early education and career choices were deeply influenced by his passion for natural history, which is evident from several key aspects of his academic pursuits and professional appointments.

1. **Education at St. John’s College, Cambridge**: Henslow was educated at St. John’s College, where he graduated as the 16th wrangler in 1818. This achievement indicates a strong foundation in mathematics and science, which are essential for studying natural history.

2. **Interest in Geology**: His passion for natural history began early in his life and significantly influenced his career choices. In 1819, Henslow accompanied Adam Sedgwick on a tour of the Isle of Wight to learn geology, marking one of his first formal engagements with geological studies. This experience laid the groundwork for his future contributions to geology.

3. **Studies in Chemistry and Mineralogy**: Henslow furthered his education by studying chemistry under Professor James Cumming and mineralogy under Edward Daniel Clarke. These disciplines are closely related to natural history, as they involve understanding the composition and structure of natural materials.

4. **Professional Appointments**:
   - In 1822, following the death of Edward Daniel Clarke, Henslow was appointed professor of mineralogy at the University of Cambridge. This appointment reflects his expertise and passion for studying minerals.
   - Two years later, he took holy orders but continued to pursue his interest in natural history by transitioning from mineralogy to botany. In 1827, he became a professor of botany, indicating a shift towards plant sciences.

5. **Botanical Work**: Henslow's work in botany included organizing a herbarium of British flora and developing methods like ""collation"" to study plant variation. His efforts culminated in the publication of *A Catalogue of British Plants* in 1829, which became an essential resource for his lecture course.

6. **Influence on Students**: Henslow's passion for natural history was also reflected in his mentorship of students like Charles Darwin, whom he inspired with a love for natural sciences. His teaching methods and experimental work in botany influenced many future scientists.

Overall, John Stevens Henslow’s early education and career choices were deeply intertwined with his passion for natural history, as evidenced by his studies in geology, chemistry, mineralogy, and botany, along with his professional roles that allowed him to explore these fields further.",ai (phi4),ai (phi4)
