,query,reference_contexts,reference_answer,reference_answer_by,query_by
6,"What significant change occurred in Henslow's life when he was appointed as rector of Hitcham, Suffolk in 1837, and how did it impact his involvement with Cambridge University?","[""== A country clergyman ==\nIn 1833, Henslow was appointed vicar of Cholsey-cum-Moulsford in Berkshire (now Oxfordshire). He continued to live in Cambridge, only visiting the parish during vacations; he appointed a curate to conduct services and parish business during term-time.\nHowever, his appointment in 1837 to the remunerative Crown living at Hitcham, Suffolk marked a turning-point in his life. This time, in 1839, he moved to the parish, and as rector of Hitcham he lived at the rectory. He worked there, endearing himself to all who knew him, until the end of his life. His energies were devoted to the improvement of his parishioners, but his influence was felt far and wide. Botany at Cambridge suffered, attendance at lectures fell, and we have records of complaints made within the university. Henslow did not resign his chair, and continued to give lectures, set and mark exams, and take part in university affairs. Nevertheless, his influence there was naturally much reduced.\nHenslow's work in Hitcham, over and above the normal duties of a Rector, can be summarised as follows:\n\n1. The Parish School and other charities. Hitcham was a poor parish, and most people would have been illiterate. Education had to be paid for, and so Henslow both raised funds and donated his own money to support a school. The school was founded in 1841, and Henslow himself gave a series of volunteer classes on Monday afternoons for some of the older children. The botanical curriculum was printed.The botany taught in this school had effects throughout Britain, because important people at the centre, such as Prince Albert and Lyon Playfair kept in touch and rightly regarded Henslow as an authority on the subject.\n2. Adult education in the Village. The Hitcham Labourers' and Mechanics' Horticultural Society was the vehicle used by Henslow to 'improve' the labouring and agricultural workers in the village and its surrounds.  Competitions, shows and excursions were the attractions, and the intent was practical, to improve agriculture by educating the parishioners. Henslow made use of gifts and facilities provided by his friends. Advances such as made by Justus von Liebig in Germany, who began to apply chemistry to the needs of agriculture, had not yet become widely utilised.\n3. Museums. The town of Ipswich is twelve miles from Hitcham. As a result of his Cambridge experiences, Henslow believed in the value of museums as vehicles for education. Ipswich Museum was established in 1847 as a natural history museum and owed much to Henslow, who was elected its President in 1850.\nAlongside this work he remained an inquiring scientist at heart. In 1843 he discovered nodules of coprolitic origin in the Red Crag at Felixstowe in Suffolk, and two years later he called attention to those also in the Cambridge Greensand and remarked that they might be of use in agriculture. Although Henslow derived no benefit, these discoveries led to the establishment of the phosphate industry in Suffolk and Cambridgeshire; and the works proved lucrative until the introduction of foreign phosphates.\nIn 1851, Carl Ludwig Blume named a genus of flowering plants belonging to the family Santalaceae, from Indo-China as Henslowia, in honour of Henslow.\nHenslow died on 16 May 1861 at Hitcham.\n\n\n== Family ==\nHenslow married Harriet Jenyns (1797–1857), daughter of George Leonard Jenyns and sister of Leonard Jenyns on 16 December 1823. Their eldest daughter Frances Harriet married Joseph Dalton Hooker, and their youngest daughter, Anne, became a botanical artist. Their sons included George Henslow (1835–1925), who became the Royal Horticultural Society's Professor of Botany and the first President of the Churchmen's Union for the Advancement of Liberal Religious Thought.""]","When Henslow was appointed as rector of Hitcham, Suffolk in 1837, a significant change occurred in his life. Unlike his previous appointment at Cholsey-cum-Moulsford where he continued to live in Cambridge and only visited the parish during vacations, this time he moved to Hitcham in 1839 and lived there permanently as rector. This relocation marked a turning point because it led him to devote much of his energy to improving his parishioners' lives.

Despite continuing his academic duties at Cambridge University—such as giving lectures, setting and marking exams, and participating in university affairs—his influence within the university naturally diminished due to his physical absence from Cambridge. Attendance at his botany lectures fell, and there were complaints about his reduced involvement in university activities. Nonetheless, Henslow maintained a connection with both his parish work and academic responsibilities until the end of his life.",ai (phi4),ai (phi4)
7,Describe the role of the Hitcham Labourers' and Mechanics' Horticultural Society in Henslow's efforts to improve agriculture and education among parishioners.,"[""== A country clergyman ==\nIn 1833, Henslow was appointed vicar of Cholsey-cum-Moulsford in Berkshire (now Oxfordshire). He continued to live in Cambridge, only visiting the parish during vacations; he appointed a curate to conduct services and parish business during term-time.\nHowever, his appointment in 1837 to the remunerative Crown living at Hitcham, Suffolk marked a turning-point in his life. This time, in 1839, he moved to the parish, and as rector of Hitcham he lived at the rectory. He worked there, endearing himself to all who knew him, until the end of his life. His energies were devoted to the improvement of his parishioners, but his influence was felt far and wide. Botany at Cambridge suffered, attendance at lectures fell, and we have records of complaints made within the university. Henslow did not resign his chair, and continued to give lectures, set and mark exams, and take part in university affairs. Nevertheless, his influence there was naturally much reduced.\nHenslow's work in Hitcham, over and above the normal duties of a Rector, can be summarised as follows:\n\n1. The Parish School and other charities. Hitcham was a poor parish, and most people would have been illiterate. Education had to be paid for, and so Henslow both raised funds and donated his own money to support a school. The school was founded in 1841, and Henslow himself gave a series of volunteer classes on Monday afternoons for some of the older children. The botanical curriculum was printed.The botany taught in this school had effects throughout Britain, because important people at the centre, such as Prince Albert and Lyon Playfair kept in touch and rightly regarded Henslow as an authority on the subject.\n2. Adult education in the Village. The Hitcham Labourers' and Mechanics' Horticultural Society was the vehicle used by Henslow to 'improve' the labouring and agricultural workers in the village and its surrounds.  Competitions, shows and excursions were the attractions, and the intent was practical, to improve agriculture by educating the parishioners. Henslow made use of gifts and facilities provided by his friends. Advances such as made by Justus von Liebig in Germany, who began to apply chemistry to the needs of agriculture, had not yet become widely utilised.\n3. Museums. The town of Ipswich is twelve miles from Hitcham. As a result of his Cambridge experiences, Henslow believed in the value of museums as vehicles for education. Ipswich Museum was established in 1847 as a natural history museum and owed much to Henslow, who was elected its President in 1850.\nAlongside this work he remained an inquiring scientist at heart. In 1843 he discovered nodules of coprolitic origin in the Red Crag at Felixstowe in Suffolk, and two years later he called attention to those also in the Cambridge Greensand and remarked that they might be of use in agriculture. Although Henslow derived no benefit, these discoveries led to the establishment of the phosphate industry in Suffolk and Cambridgeshire; and the works proved lucrative until the introduction of foreign phosphates.\nIn 1851, Carl Ludwig Blume named a genus of flowering plants belonging to the family Santalaceae, from Indo-China as Henslowia, in honour of Henslow.\nHenslow died on 16 May 1861 at Hitcham.\n\n\n== Family ==\nHenslow married Harriet Jenyns (1797–1857), daughter of George Leonard Jenyns and sister of Leonard Jenyns on 16 December 1823. Their eldest daughter Frances Harriet married Joseph Dalton Hooker, and their youngest daughter, Anne, became a botanical artist. Their sons included George Henslow (1835–1925), who became the Royal Horticultural Society's Professor of Botany and the first President of the Churchmen's Union for the Advancement of Liberal Religious Thought.""]","The Hitcham Labourers' and Mechanics' Horticultural Society played a significant role in Henslow's efforts to enhance both agriculture and education among the parishioners of Hitcham. This society served as a practical vehicle for ""improving"" the laboring and agricultural workers within the village and its surrounding areas. The primary intent behind this initiative was educational, aiming to elevate agricultural practices by educating the local community.

Henslow utilized various methods through the society to engage parishioners in learning and development. These included organizing competitions, shows, and excursions that were designed not only as attractions but also as practical means of imparting knowledge about better agricultural techniques. The society provided a platform for hands-on learning experiences, which was crucial at a time when theoretical advances in agriculture, such as those made by Justus von Liebig in Germany, had yet to be widely adopted.

Moreover, Henslow leveraged gifts and facilities from his friends to support the activities of the society, thereby enriching the resources available for educational purposes. Through these efforts, he aimed to foster a more informed and skilled agricultural workforce, ultimately contributing to the improvement of local agriculture in Hitcham. The society thus became an integral part of Henslow's broader mission to uplift his parishioners through education and practical application of knowledge.",ai (phi4),ai (phi4)
8,"How did Henslow contribute to the establishment of Ipswich Museum, and what was its significance in terms of educational value?","[""== A country clergyman ==\nIn 1833, Henslow was appointed vicar of Cholsey-cum-Moulsford in Berkshire (now Oxfordshire). He continued to live in Cambridge, only visiting the parish during vacations; he appointed a curate to conduct services and parish business during term-time.\nHowever, his appointment in 1837 to the remunerative Crown living at Hitcham, Suffolk marked a turning-point in his life. This time, in 1839, he moved to the parish, and as rector of Hitcham he lived at the rectory. He worked there, endearing himself to all who knew him, until the end of his life. His energies were devoted to the improvement of his parishioners, but his influence was felt far and wide. Botany at Cambridge suffered, attendance at lectures fell, and we have records of complaints made within the university. Henslow did not resign his chair, and continued to give lectures, set and mark exams, and take part in university affairs. Nevertheless, his influence there was naturally much reduced.\nHenslow's work in Hitcham, over and above the normal duties of a Rector, can be summarised as follows:\n\n1. The Parish School and other charities. Hitcham was a poor parish, and most people would have been illiterate. Education had to be paid for, and so Henslow both raised funds and donated his own money to support a school. The school was founded in 1841, and Henslow himself gave a series of volunteer classes on Monday afternoons for some of the older children. The botanical curriculum was printed.The botany taught in this school had effects throughout Britain, because important people at the centre, such as Prince Albert and Lyon Playfair kept in touch and rightly regarded Henslow as an authority on the subject.\n2. Adult education in the Village. The Hitcham Labourers' and Mechanics' Horticultural Society was the vehicle used by Henslow to 'improve' the labouring and agricultural workers in the village and its surrounds.  Competitions, shows and excursions were the attractions, and the intent was practical, to improve agriculture by educating the parishioners. Henslow made use of gifts and facilities provided by his friends. Advances such as made by Justus von Liebig in Germany, who began to apply chemistry to the needs of agriculture, had not yet become widely utilised.\n3. Museums. The town of Ipswich is twelve miles from Hitcham. As a result of his Cambridge experiences, Henslow believed in the value of museums as vehicles for education. Ipswich Museum was established in 1847 as a natural history museum and owed much to Henslow, who was elected its President in 1850.\nAlongside this work he remained an inquiring scientist at heart. In 1843 he discovered nodules of coprolitic origin in the Red Crag at Felixstowe in Suffolk, and two years later he called attention to those also in the Cambridge Greensand and remarked that they might be of use in agriculture. Although Henslow derived no benefit, these discoveries led to the establishment of the phosphate industry in Suffolk and Cambridgeshire; and the works proved lucrative until the introduction of foreign phosphates.\nIn 1851, Carl Ludwig Blume named a genus of flowering plants belonging to the family Santalaceae, from Indo-China as Henslowia, in honour of Henslow.\nHenslow died on 16 May 1861 at Hitcham.\n\n\n== Family ==\nHenslow married Harriet Jenyns (1797–1857), daughter of George Leonard Jenyns and sister of Leonard Jenyns on 16 December 1823. Their eldest daughter Frances Harriet married Joseph Dalton Hooker, and their youngest daughter, Anne, became a botanical artist. Their sons included George Henslow (1835–1925), who became the Royal Horticultural Society's Professor of Botany and the first President of the Churchmen's Union for the Advancement of Liberal Religious Thought.""]","John Stevens Henslow contributed significantly to the establishment of Ipswich Museum by leveraging his experiences and beliefs about the educational value of museums. As someone who had a deep appreciation for natural history and education, Henslow recognized that museums could serve as important vehicles for public learning and engagement with science.

Henslow's involvement in the creation of Ipswich Museum began when it was established in 1847 as a natural history museum. His influence on the museum was substantial; he became its President in 1850, indicating his active role in guiding its development and ensuring that it fulfilled its educational mission. Henslow's commitment to education is evident from his efforts to improve the lives of his parishioners through various initiatives, such as founding a school with a botanical curriculum and promoting adult education.

The significance of Ipswich Museum in terms of educational value lies in its role as an accessible resource for learning about natural history. By providing exhibits and collections related to natural science, the museum offered opportunities for self-education and inspiration to both locals and visitors. It served as a platform for disseminating scientific knowledge and fostering curiosity among the general public, aligning with Henslow's broader educational goals.

Overall, Henslow's contribution to Ipswich Museum was rooted in his belief that museums could democratize education by making scientific knowledge available to all, thereby enhancing public understanding of natural history and its relevance to everyday life.",ai (phi4),ai (phi4)
9,"On what date did John Stevens Henslow marry Harriet Jenyns, and how was she related to Leonard Jenyns?","['== Family ==\nHenslow married Harriet Jenyns (1797–1857), daughter of George Leonard Jenyns and sister of Leonard Jenyns on 16 December 1823. Their eldest daughter Frances Harriet married Joseph Dalton Hooker, and their youngest daughter, Anne, became a botanical artist. Their sons included George Henslow (1835–1925), who became the Royal Horticultural Society\'s Professor of Botany and the first President of the Churchmen\'s Union for the Advancement of Liberal Religious Thought.\n\n\n== Selected publications ==\nHenslow, John Stevens (1822). ""Geological Description of Anglesea"". Transactions of the Cambridge Philosophical Society. 1: 359–452.\nHenslow, John Stevens. (1823). A Syllabus of a Course of Lectures on Mineralogy. Deighton (reissued by Cambridge University Press, 2009; ISBN 978-1-108-00201-1)\nHenslow, John Stevens. (1829; 2nd ed. 1835). A Catalogue of British Plants.\nHenslow, John Stevens. (1835). The Principles of Descriptive and Physiological Botany. Longman, Rees, Orme, Brown & Green (reissued by Cambridge University Press, 2009; ISBN 978-1-108-00186-1)\nHenslow, John Stevens. (1846). The Teaching of Science in Cambridge. Metcalfe and Palmer (reissued by Cambridge University Press, 2009; ISBN 978-1-108-00200-4)\nHenslow, John Stevens. (1856). A Dictionary of Botanical Terms. Groombridge (reissued by Cambridge University Press, 2009; ISBN 978-1-108-00131-1)\nHenslow, John Stevens, and Skepper, E. (1866). Flora of Suffolk\n\n\n== References ==\n\nThis article incorporates text from a publication now in the public domain: Chisholm, Hugh, ed. (1911). ""Henslow, John Stevens"". Encyclopædia Britannica. Vol. 13 (11th ed.). Cambridge University Press. p. 303.\n\n\n== Sources ==\n\n\n== External links ==\n\nComplete Correspondence of John Stevens Henslow Searchable full texts of over 1000 letters to and from Henslow']","John Stevens Henslow married Harriet Jenyns on December 16, 1823. Harriet Jenyns was the daughter of George Leonard Jenyns and the sister of Leonard Jenyns.

**Explanation:**

The context information provided states that John Stevens Henslow married Harriet Jenyns on December 16, 1823. It also mentions that Harriet was the daughter of George Leonard Jenyns and the sister of Leonard Jenyns. This establishes both the date of their marriage and Harriet's relationship to Leonard Jenyns.",ai (phi4),ai (phi4)
10,"Which of John Stevens Henslow's daughters became a botanical artist, and who did his eldest daughter Frances Harriet marry?","['== Family ==\nHenslow married Harriet Jenyns (1797–1857), daughter of George Leonard Jenyns and sister of Leonard Jenyns on 16 December 1823. Their eldest daughter Frances Harriet married Joseph Dalton Hooker, and their youngest daughter, Anne, became a botanical artist. Their sons included George Henslow (1835–1925), who became the Royal Horticultural Society\'s Professor of Botany and the first President of the Churchmen\'s Union for the Advancement of Liberal Religious Thought.\n\n\n== Selected publications ==\nHenslow, John Stevens (1822). ""Geological Description of Anglesea"". Transactions of the Cambridge Philosophical Society. 1: 359–452.\nHenslow, John Stevens. (1823). A Syllabus of a Course of Lectures on Mineralogy. Deighton (reissued by Cambridge University Press, 2009; ISBN 978-1-108-00201-1)\nHenslow, John Stevens. (1829; 2nd ed. 1835). A Catalogue of British Plants.\nHenslow, John Stevens. (1835). The Principles of Descriptive and Physiological Botany. Longman, Rees, Orme, Brown & Green (reissued by Cambridge University Press, 2009; ISBN 978-1-108-00186-1)\nHenslow, John Stevens. (1846). The Teaching of Science in Cambridge. Metcalfe and Palmer (reissued by Cambridge University Press, 2009; ISBN 978-1-108-00200-4)\nHenslow, John Stevens. (1856). A Dictionary of Botanical Terms. Groombridge (reissued by Cambridge University Press, 2009; ISBN 978-1-108-00131-1)\nHenslow, John Stevens, and Skepper, E. (1866). Flora of Suffolk\n\n\n== References ==\n\nThis article incorporates text from a publication now in the public domain: Chisholm, Hugh, ed. (1911). ""Henslow, John Stevens"". Encyclopædia Britannica. Vol. 13 (11th ed.). Cambridge University Press. p. 303.\n\n\n== Sources ==\n\n\n== External links ==\n\nComplete Correspondence of John Stevens Henslow Searchable full texts of over 1000 letters to and from Henslow']","John Stevens Henslow's youngest daughter, Anne, became a botanical artist. His eldest daughter, Frances Harriet, married Joseph Dalton Hooker.",ai (phi4),ai (phi4)
11,Name one publication by John Stevens Henslow that focuses on botany and provide its year of first publication.,"['== Family ==\nHenslow married Harriet Jenyns (1797–1857), daughter of George Leonard Jenyns and sister of Leonard Jenyns on 16 December 1823. Their eldest daughter Frances Harriet married Joseph Dalton Hooker, and their youngest daughter, Anne, became a botanical artist. Their sons included George Henslow (1835–1925), who became the Royal Horticultural Society\'s Professor of Botany and the first President of the Churchmen\'s Union for the Advancement of Liberal Religious Thought.\n\n\n== Selected publications ==\nHenslow, John Stevens (1822). ""Geological Description of Anglesea"". Transactions of the Cambridge Philosophical Society. 1: 359–452.\nHenslow, John Stevens. (1823). A Syllabus of a Course of Lectures on Mineralogy. Deighton (reissued by Cambridge University Press, 2009; ISBN 978-1-108-00201-1)\nHenslow, John Stevens. (1829; 2nd ed. 1835). A Catalogue of British Plants.\nHenslow, John Stevens. (1835). The Principles of Descriptive and Physiological Botany. Longman, Rees, Orme, Brown & Green (reissued by Cambridge University Press, 2009; ISBN 978-1-108-00186-1)\nHenslow, John Stevens. (1846). The Teaching of Science in Cambridge. Metcalfe and Palmer (reissued by Cambridge University Press, 2009; ISBN 978-1-108-00200-4)\nHenslow, John Stevens. (1856). A Dictionary of Botanical Terms. Groombridge (reissued by Cambridge University Press, 2009; ISBN 978-1-108-00131-1)\nHenslow, John Stevens, and Skepper, E. (1866). Flora of Suffolk\n\n\n== References ==\n\nThis article incorporates text from a publication now in the public domain: Chisholm, Hugh, ed. (1911). ""Henslow, John Stevens"". Encyclopædia Britannica. Vol. 13 (11th ed.). Cambridge University Press. p. 303.\n\n\n== Sources ==\n\n\n== External links ==\n\nComplete Correspondence of John Stevens Henslow Searchable full texts of over 1000 letters to and from Henslow']","One publication by John Stevens Henslow that focuses on botany is ""A Catalogue of British Plants,"" which was first published in 1829.",ai (phi4),ai (phi4)
