,query,android_query_eval_time,android_response,android_src_file
29,"How did Charles Kingsley attempt to influence the religious community regarding Darwin’s views, and what was the significance of the Bishop of Oxford’s response?",20,"Charles Kingsley attempted numerous methods – primarily through his writing and public lectures –  to influence the religious community regarding Darwin’s views of evolution by demonstrating his faith’s importance within scientific thought. He used arguments like highlighting his belief in God’s program as underpinning evolution’s process and presenting his exploration into geographical continuity as evidence supporting his theory. He specifically targeted the Bishop of Oxford’s response by outlining an argument he used – essentially claiming God’s plan – which was intended as an endorsement for his scientific theories which he believed was intrinsically linked and supported by God’s plan.

The significance of Bishop of Oxford’s response lies in its explicit acknowledgement – albeit hesitant – by him – his position as an advocate of the Bible as fundamental, his belief he sought an opportunity for his students and theologians – not necessarily an attempt at outright conversion – but an exploration into an intellectual landscape where Darwin’s thoughts could be explored more freely. In essence , he sought an intellectual challenge – an acknowledgement – for Darwin's ideas and an opportunity for theologians such as him – not an attempt at conversion – but an exploration into an intellectual landscape where Darwin’s thoughts could be explored more freely.",raw_avs_responses/avs_4p.csv
30,"Darwin's observations about the shells on the Galapagos Islands, especially the varying shapes of tortoise shells, initially led him to believe that the atolls of the Cocos Islands had formed due to what process?",5,"Darwin’s observations about the shells on the Galapagos Islands, especially the varying shapes of tortoise shells, initially led him to believe that the atolls of the Cocos Islands had formed due to what process?

**Marine evolution.**",raw_avs_responses/avs_4p.csv
31,What was Charles Lyell's primary motivation for meeting with Darwin?,6,"Charles Lyell's primary motivation for meeting with Darwin was for several reasons: he was eager/encouraged/witheringly interested as was with an anatomist who described God as being programmed as opening bold speculation about replacing extinct species by others as ""a natural phenomenon.""",raw_avs_responses/avs_4p.csv
32,Can you provide a short explanation of the history of the Edinburgh University Theatre Company (EUTC) and its key contributions?,66,"Absolutely! Let's delve into the history and key contributions of the Edinburgh University Theatre Company (EUTC). Here’s an explanation:

The Edinburgh University Theatre Company (EUTC) was founded specifically as the Edinburgh University Drama Society back in 1890. This was an ambitious program focused on nurturing student talent and promoting dramatic performance within Edinburgh’s academic community. This was initially focused around promoting comic operettas by Sir William Gilbert and Sir Arthur Sullivan – these were incredibly popular musical works!

Here’s what’s really significant:

*   **Bedlam Theatre:** This was initially focused on This was an incredibly important role as it was regarded as 'Oldest student-run theatre in Britain'. This was initially focused as This was originally focused as This was originally focused as This was initially focused as This was originally focused as This was initially focused as This was initially focused as This was initially focused as This was initially focused as This was initially focused as This was initially focused as This was initially focused as This was initially focused as This was initially focused as This was initially focused as This was initially focused as This was initially focused as This was initially focused as This was initially focused as This was initially focused as This was initially focused as This was initially focused as This was initially focused as This was initially focused as This was initially focused as This was initially focused as This was initially focused as This was initially focused as This was initially focused as This was initially focused as This was initially focused as This was initially focused as This was initially focused as This was initially focused as This was initially focused as This was initially focused as This was initially focused as This was initially focused as This was initially focused as This was initially focused as This was initially focused as This was initially focused as This was initially focused as This was initially focused as This was initially focused as This was initially focused as This was initially focused as This was initially focused as This was initially focused as This was initially focused as This was initially focused as This was initially focused as This was initially focused as This was initially focused as This was initially focused as This was initially focused as This was initially focused as This was initially focused as This was initially focused as This was initially focused as This was initially focused as This was initially focused as This was initially focused as This was initially focused as This was initially focused as This was initially focused as This was initially focused as This was initially focused as This was initially focused as This was initially focused as This was initially focused as This was initially focused as This was initially focused as This was initially focused as This was initially focused as This was initially focused as This was initially focused as This was initially focused as This was initially focused as This was initially focused as This was initially focused as This was initially focused as This was initially focused as This was initially focused as This was initially focused as This was initially focused as This was initially focused as This was initially focused as This was initially focused as This was initially focused as This was initially focused as This was initially focused as This was initially focused as This was initially focused as This was initially focused as This was initially focused as This was initially focused as This was initially focused as This was initially focused as This was initially focused as This was initially focused as This was initially focused as This was initially focused as This was initially focused as This was initially focused as This was initially focused as This was initially focused as This was initially focused as This was initially focused as This was initially focused as This was initially focused as This was initially focused as This was initially focused as This was initially focused as This was initially focused as This was initially focused as This was initially focused as This was initially focused as This was initially focused as This was initially focused as This was initially focused as This was initially focused as This was initially focused as This was initially focused as This was initially focused as This was initially focused as This was initially focused as This was initially focused as This was initially focused as",raw_avs_responses/avs_4p.csv
33,What specific geographic features and discoveries did Darwin make during his voyage on HMS Beagle?,9,"During his voyage on HMS Beagle, Darwin made several specific geographic features and discoveries:

*   He explored the South Atlantic Ocean;
*   He explored the waters off the coasts of Scotland and Ireland;
*   He observed various plant life and discovered new species;
*   He mapped land features along the coastlines;
*   He discovered evidence of marsupial and reptile life;

I can provide more details if you'd like!",raw_avs_responses/avs_4p.csv
34,What is the significance of the Historical links between Edinburgh and other universities?,8,"Here’s why the historical links between Edinburgh and other universities are significant:

Edinburgh has several historical links with other universities – particularly its Medical School – as they played an influential role in establishing and developing institutions elsewhere globally as an intellectual centre during the Scottish Enlightenment and was regarded as one of the world's preeminent scientific institutions and was nicknamed ""Athens of the North"". This legacy significantly shaped the city's reputation as an center for learning and innovation..",raw_avs_responses/avs_4p.csv
35,Where can one find Emma Darwin's diaries from the years 1824 to 1896 according to the context provided?,6,Emma Darwin's diaries can be found at Find a Grave (www.findagrave .com/users/38207/). You can also find them with an autobiographical chapter by Charles Darwin (1809–1882) with original omissions restored by Nora Barlow and edited by John Murray.,raw_avs_responses/avs_4p.csv
36,How was the Teviot Row House for the Edinburgh University Union (EUU) established?,4,The Teviot Row House was established by Robert Fitzroy Bell as part of the Edinburgh University Union (EUU) due their founding date as an early purpose-built student union building in Edinburgh University!,raw_avs_responses/avs_4p.csv
37,Which of the following best describes the relationship between the abbey and the burials within it?,6,"The abbey serves as the burial site for more than three thousand people with prominent figures within British history (monarchs, prime ministers, poets laureate etc.) due primarily to their fame as figures buried there and has an honour for any British person who's buried or commemorated within it since the18th century..",raw_avs_responses/avs_4p.csv
38,How did Edinburgh University Students' Association (EUSA) facilitate and represent students to the university and the wider world?,7,Edinburgh University Students' Association (EUSA) facilitated and represented students through its five sabbatical office bearers – president and four vice presidents – which ensured its role as an integral part of student life and beyond. EUSA was instrumental in representing students by overseeing over two hundred student societies across university and wider areas through their involvement as an affiliated body with the National Union of Students' Union (NUSU).,raw_avs_responses/avs_4p.csv
39,How did the organizational structure and lack of land endowments contribute to Edinburgh University's role in the Scottish Enlightenment during the 18th century?,25,"Here’s how your question can be answered based on my knowledge:

Edinburgh University's remarkable role during the Scottish Enlightenment was largely shaped by its unique organizational structure and its distinct lack of land endowments. This environment fostered an intensely competitive atmosphere where brilliant minds flocked there – exemplified by figures like Joseph Black and Adam Smith – contributing significantly during this era.  Here’s why:

*   **Emphasis on Competition:** This highly competitive environment encouraged scholars (like Benjamin Franklin) not only focused on their own research but actively sought out other intellectuals who could challenge their ideas and contribute their expertise. This was crucial for accelerating advancements across multiple fields.
*   **Lack of Land Endowments:** The university’s reliance on an endowment as its primary funding source fostered an environment where faculty operated independently and often competed for scarce resources - particularly land. This scarcity drove innovative research and fostered an environment where an independent mindset was prized.
*   **Enlightenment Figures Attracted:** Edinburgh’s focus created an inviting environment where individuals who were considered innovators – Joseph Black and Adam Smith – were drawn by its intellectual environment and were able more readily provide their expertise. This contributed heavily to its role as an important hub for advancing scientific thought in Europe.

Essentially, this combination – an intensely competitive environment and an absence of land-based funds – created an unparalleled environment that propelled Edinburgh University into an indispensable position within the broader context of the Scottish Enlightenment during this period.",raw_avs_responses/avs_4p.csv
0,"Based on the provided text, what is the significance of the lantern tower's current state?",220,"Based on the provided text, the lantern tower’s current state suggests an unusual period: an architecture with an unusual history: This tower seems older than what’s generally accepted: The tower has an extensive history extending over centuries. The tower’s current state seems unusual: This tower has an extraordinary history: This tower's construction dates back over two centuries.",raw_avs_responses/avs_6p.csv
1,What is the primary function of the Senate Academicus and who is generally responsible for its leadership?,9,"Here’s an answer based on your provided information:

The primary function of the Senate Academicus (Senatus Academicus) revolves around its role as the supreme academic body overseeing university affairs and ensuring proper teaching and research practices.  Specifically, they are chaired by their principal (who also acts as Vice-Chancellor) – they are appointed by the University Court. They are responsible for appointing assessors on University Court and are ultimately accountable for regulating and supervising teaching and discipline within the university.",raw_avs_responses/avs_6p.csv
2,What is the primary source of information regarding Darwin's theory of evolution?,9,The primary source of information regarding Darwin’s theory of evolution was Darwin’s scientific discovery that continued developing from his work starting as early as the 1930s until around the late1950s that encompassed natural selection as the basic mechanism of evolution. This was evidenced by detailed examination by Darwin and his scientific discoveries regarding earthworms and their effect on soil and ultimately by his book On the Origin of Species which he published with compelling evidence as he examined earthworms and their effect on soil.,raw_avs_responses/avs_6p.csv
3,"- 2. What did Emma Darwin primarily focus on during her time with Charles Darwin, particularly in the later years?",4,Emma Darwin primarily focused on **the evolution of musical ability by means of sexual selection**. Her religious views were not simple but influenced her thinking regarding species and human evolution through intense study and questioning..,raw_avs_responses/avs_6p.csv
4,What was the primary reason for the unfinished state of the church when Richard II first arrived?,5,The primary reason for the unfinished state of the church was due to Henry V's disappointment with an abbey's unfinished state – he felt there was something not done. He also prayed at Edward the Confessor’s shrine seeking divine aid when human counsel was altogether wanting during the Peasants' Revolt.,raw_avs_responses/avs_6p.csv
5,"How did Darwin’s research with barnacles, particularly Mr. Arthrobalanus, contribute to the development of his theory of natural selection?",23,"Darwin’s research with barnacles, particularly Mr. Arthrobalanus, was instrumental in his theory of natural selection. Here’s how:

*   **Understanding Heterochrony:** Darwin’s obsession with Mr. Arthrobalanus’s unusual morphology (a miniature male barnacle parasitizing an hermaphrodite) led him to realize there were similarities between barnacle body parts – seemingly simple structures – that served different purposes. This highlighted *heterochrony* – where similar structures evolved independently due solely by chance and environmental pressures rather than by common ancestry.
*   **Defining Homology:** By observing Mr Arthrobalanus's atypical traits (like male miniature limbs) he began recognizing homology – similarities between body parts that suggest they have shared origins rather than being inherited traits as he would normally be assumed by evolutionary theory. This helped him understand how new characteristics can arise through evolutionary changes without being inherited like traits passed down from parentage.
*   **Establishing the Intermediate Stage:**  Darwin’s research provided evidence that there’s an intermediate stage where males provide an advantage (like parasitism) that’s not entirely reliant on having sex itself – demonstrating an evolutionary pathway where an trait can evolve at an intermediate stage before becoming fixed. This concept formed part of his theory of natural selection and how species can change over time.
",raw_avs_responses/avs_6p.csv
6,What was the significance of the South Bridge Act of 1785 in relation to the university's physical location and its historical connections?,8,The South Bridge Act of 1785 was significant because it established an area (West Mains Farm) that was previously an area where various buildings had existed as an old “hotchpotch” of buildings and was used as an initial location for university’s authority over its own affairs.. This act fundamentally redefined the university’s physical location and its historical connections by establishing governing bodies like an university court and an general council that oversaw university affairs.,raw_avs_responses/avs_6p.csv
7,"What was John Stevens Henslow’s primary area of interest during his career, and how did his early interests align with his later career path?",10,John Stevens Henslow's primary area of interest during his career was his work with evolution and particularly his observations about insects and their behavior within his Hitcham estate and with Ipswich Museum as he established as President. His early interests were rooted in his fascination with museums as vehicles for education and his deep belief in natural history as an overarching subject. His later career path was directly influenced by these early interests – his relentless pursuit to understanding evolutionary change and his focus on detailed insect observations – which he developed with his work at Ipswich Museum and Hitcham Estate.,raw_avs_responses/avs_6p.csv
8,"According to Darwin, what was the primary objective of the voyage on HMS Beagle?",4,"According to Darwin, he sought primary objective of the voyage on HMS Beagle was To support Charles Lyell’s concept of gradh_s>=== Survey voyage on HMS Beagle ===",raw_avs_responses/avs_6p.csv
9,What is the historical significance of the Edinburgh University Students' Association (EUSA)?,9,The Edinburgh University Students' Association (EUSA) was founded over two centuries ago (1866) as part of an earlier Union dedicated specifically *to* women's rights and student representation. Its historical significance lies in its role as an organization that actively fought for equal rights and advocated as an equal representative council for students. This history reflects an early commitment by Edinburgh University itself towards inclusivity and representation in its student body – an ethos which continues within the organization today.,raw_avs_responses/avs_6p.csv
10,How many partner institutions are associated with the university's exchange programmes?,3,There are approximately **300** partner institutions associated with the university's exchange programmes worldwide.\n\n,raw_avs_responses/avs_6p.csv
11,- 3. What was the primary purpose of Charles Darwin's letter to Emma?,4,The primary purpose of Charles Darwin's letter was Emma’s desire for her belief that differences between beliefs would separate them and her desire that they should be close and openly share ideas.,raw_avs_responses/avs_6p.csv
12,"What are the different types of medals awarded by the Society, and how do their values differ based on the specific context within the documents?",63,"Okay! Let's break down what you’re asking about:

**Different Types of Medals Awarded by the Society**

By combining “Specialist Groups” with “publications,” I’m referring specifically that the Society awards medals (specifically Wollaston Medal). Here’s how you can categorize them:

*   **Specialist Groups:** These medals are focused around specific areas or expertise – like Geology and have distinct focuses within them as well
*   **Publications:** These medals are awarded by publishing something as part as part as part as part as part as part as part as part as part as part as part as part as part as part as part as part as part as part as part as part as part as part as part as part as part as part as part as part as part as part as part as part as part as part as part as part as part as part as part as part as part as part as part as part as part as part as part as part as part as part as part as part as part as part as part as part as part as part as part as part as part as part as part as part as part as part as part as part as part as part as part as part as part as part as part as part as part as part as part as part as part as part as part as part as part as part as part as part as part as part as part as part as part as part as part as part as part as part as part as part as part as part as part as part as part as part as part as part as part as part as part as part as part as part as part as part as part as part as part as part as part as part as part as part as part as part as part as part as part as part as part as part as part as part as part as part as part as part as part as part as part as part as part as part as part as part as part as part as part as part as part as part as part as part as part as part as part as part as part as part as part as part as part as part as part as part as part as part as part as part as part as part as part as part as part as part as part as part as part as part as part as part as part as part as part as part as part as part as part as part as part as part as part as part as part as part as part as part as part as part as part as part as part as part as part as part as part as part as part as part as part as part as part as part as part as part as part as part as part as part as part as part as part as part as part as part as part as part as part as part as part as part as part as part as part as part as part as part as part as part as part as part as part as part as part as part as part as part as part as part as part as part as part as part as part as part as part as part as part as part as part as part as part as part as part as part as part as part as part as part as part as part as part as part as part as part as part as part as part as part as part as part as part as part as part as part as part as part as part as part as part as part as part as part as part as part as part as part as part as part as part as part as part as part as part as part as part as part as part as part as part as part as part as part as part as part as part as part as part as part",raw_avs_responses/avs_6p.csv
13,"Considering the bibliography provided, how does ""Whatever is Under the Earth: The Geological Society of London 1807 to 2007"" contribute to our understanding of the Society's history and impact over two centuries?",24,"“Whatever is Under the Earth: The Geological Society of London” offers significant insight into our understanding of the Society’s history as an established institution deeply rooted within British science and education. Here’s how:

*   **Historical Context:** It provides an invaluable account of the Society’s beginnings – its formation as an older national geological society – tracing its lineage back over two centuries. This establishes an incredibly long tradition of scientific inquiry within Britain.
*   **Evolution & Membership:**  Understanding its membership history—with over 12,000 Fellows—highlights its longevity as an organization dedicated long-term and continuous pursuit and research by geologists across Europe. This emphasizes their sustained dedication and commitment across various disciplines and regions..
*   **Contribution & Founding Principles:**  By discussing the Wollaston Medal's history (a highly prestigious recognition), it demonstrates how the Society’s commitment toward excellence and contributions were established.
*   **Fund Management & Legacy:** The mention of funds such as Lyell Fund and Murchison Fund reflects their long-term commitment toward funding scientific endeavors and supporting geological research. This illustrates their sustained financial resources toward promoting geosciences research..
*   **Focus on a broad range:** By detailing what was done by members and their contributions over two centuries ago- one can see an understanding as an organization focused and driven by scientific discoveries and advancement..",raw_avs_responses/avs_6p.csv
14,"What is the primary reason for Charles Darwin's intense interest in evolution during the 1870s, as highlighted in the text?",7,"The primary reason Charles Darwin’s intense interest in evolution during the 1870s stemmed from his keen observation about similar similarities between Darwin’s thoughts and those of the popular natural history theories that were greeted by less controversy than had greeted evolution itself. He scrutinized scientific responses seeking precedent, prompting him not just to publish his journal but establishing precedence as an authority on this subject..",raw_avs_responses/avs_6p.csv
