,query,android_query_eval_time,android_response,android_src_file
32,"What was the original purpose of the elaborate medieval ceremony associated with the founding of the Most Honourable Order of the Bath, and how often are installation ceremonies held at the abbey?",6,The original purpose of the elaborate medieval ceremony associated with founding the Most Honourable Order of the Bath was specifically for appointing an knight and an elaborate ritual included bathing as an element as part of the ceremony as an act of purification as well as as an honor for an order's member. Installation ceremonies are held at the abbey every four years.,raw_avs_responses/avs_2p.csv
33,"The Henry VII Lady Chapel is notable for its decoration, particularly the 95 statues of saints.  What is a significant detail about the ceiling's design?",3,The Henry VII Lady Chapel’s pendant-and fan vault-style ceiling design notable for its significant detail about its design involves intricate sculptures representing saints.,raw_avs_responses/avs_2p.csv
34,"What was Darwin's primary interest in early life and education, and how did it influence his intellectual development?",8,"Darwin’s primary interest was his fascination with natural science and his drive for exploration throughout his early life and education, particularly during his voyage aboard HMS Beagle. This thirst for knowledge fostered an intense curiosity about various species and phenomena of the natural world – leading him toward his groundbreaking theories about evolution by natural selection. This curiosity significantly influenced his intellectual development by fueling his desire for discovery and ultimately drove him toward his goal in understanding species relationships and evolutionary processes.",raw_avs_responses/avs_2p.csv
35,"What was the significance of Thomas Huxley's response during the 1860 Oxford evolution debate, and how did it symbolize the relationship between science and religion at that time?",31,"Okay! Let's break down Thomas Huxley’s response during the1860 Oxford evolution debate:

Huxley’s contribution was absolutely crucial – he essentially launched an intellectual battleground between evolution and traditional religious dogma. Here’s what he did:

*   **He confronted Bishop Wilberforce:** Huxley directly challenged the Bishop Wilberforce’s stance on evolution – which was deeply tied and heavily defended by traditional Christianity – by arguing that evolution was not inconsistent with natural theology (i.e., religion could be understood alongside scientific observation).
*   **He portrayed polarisation:** Huxley painted Huxley as someone who vehemently opposed authority. This symbolized an increasingly divisive era where rational science was competing against established religious beliefs. This was an effort in overturning what was thought to be an established view.


**What did it symbolize?**

His response symbolized many things:

*   **Rejection:** It signified an unwillingness by some religious figures—particularly bishops—to acknowledge evolution as an explanation of life's origins and change.
*   **Science-Religion Dialogue:**  Ultimately, Huxley’s stance wasn’t simply about rejecting religion; he sought *reconciliation*. He argued there was an openness between science *and* faith – an area where both could be valid ways of understanding the world.
*   **Challenge:** It was an attempt at pushing boundaries and reshaping how science was considered – one where science wasn’t seen as competing religion but as an independent way to explain nature’s processes.

Essentially, Huxley's actions were an attempt at reshaping how science could be viewed alongside religion as an understanding, rather than as opposition. It was an attempt to create an understanding where there was space between science and religion- which ultimately would be seen as an attempt toward something new!",raw_avs_responses/avs_2p.csv
36,"The document details the history of stained glass at Westminster Abbey.  Besides the typical replacement of clear glass, what specific type of glass was utilized in the 19th century, and what was the significance of this change?",7,"The document details that stained glass was replaced with clear glass since the nineteenth century by artists such as Ninian Comper and Hugh Easton and Alan Younger. Specifically, they used an iPad and replicating the backlight that came through stained glass which was significant as they were replicating John Lawson’s design and the Elizabeth II’s coat arms.",raw_avs_responses/avs_2p.csv
37,"What was Darwin's primary motivation for joining the Plinian Society, and how did it shape his intellectual development?",21,"Okay! Let’s break this down. Darwin’s primary motivation for joining the Plinian Society was driven by his dissatisfaction with his experiences during his voyage on HMS Beagle and his desire for scientific advancement – specifically his support for Charles Lyell’s theory of gradens, which he found dull but essential. This society played an *enormously* significant role in shaping his intellectual development by:

*   **Providing an outlet for his dissatisfaction:** He wasn’t simply seeking an academic position; he wanted opportunities *to learn* and *to contribute* meaningfully *to* his understanding *of* natural sciences.
*   **Supporting the advancement of Lyell's Theory:** He sought out lectures where he could engage with his brother Erasmus about their research into Gradens and he found those lectures less contentious than public debates about creationism – which in turn helped him strengthen his understanding of his ideas. This helped ensure he could properly formulate his theories.

Essentially, joining the Plinian Society was Darwin’s *intentional* step towards becoming an influential scientist by engaging with an active community dedicated *to* scientific inquiry – which allowed him space and an opportunity which fueled his intellectual growth!",raw_avs_responses/avs_2p.csv
38,"What specific geological information did Darwin gather during his trip, beyond the standard coastline surveys?",4,Darwin gathered detailed investigations regarding geographical distribution of wildlife and fossils during his trip beyond standard coastline surveys by focusing on his observations and theories related to gradual geological change following his voyage on HMS Beagle.,raw_avs_responses/avs_2p.csv
39,What type of architectural style was the abbey built in?,3,The abbey was built using an architectural style known as Gothic with an emphasis on spiral staircase to allow public access.,raw_avs_responses/avs_2p.csv
0,Which of the mentioned scientific disciplines has the most significant contribution to the history of medicine?,207,"The most significant contribution from the mentioned scientific disciplines towards the history of medicine comes from **Modern Geology** with James Hutton’s contribution and Charles Darwin’s contribution as well as Richard Bright’s contribution with Nephrology, which heavily influenced medical practices with his work on physiological systems and evolution of biological understanding as well as his contribution with Electromagnetism and evolution by Darwin influencing medical practices as well as Joseph Lister's contributions as well as Thomas Bayes’s contributions and Peter Guthrie Tait’s contributions that heavily influenced modern cardiology and neurology with his work on physiological systems and evolution of biological understanding..",raw_avs_responses/avs_4p.csv
1,"According to the text, how did the monks of Westminster Abbey avoid being ejected under Elizabeth I?",3,"According to the text:
Monks under the Catholic Mary I were ejected under Elizabeth I in1559, making their exemption difficult
",raw_avs_responses/avs_4p.csv
2,What was the primary reason for the dissolution of Westminster Abbey in 1550?,7,The primary reason for the dissolution of Westminster Abbey in 1550 was due for an uncertainty caused by Henry VIII’s English Reformation – specifically the dissolution and reformation that took place between Henry VIII's time and the dissolution and reformation that was retroactively applied as Westminster Abbey's two churches were recognised as cathedral churches as well as the abbey's golden feretory as dean of the cathedral..,raw_avs_responses/avs_4p.csv
3,What is the primary motivation behind Darwin’s intense focus on transmutation research?,7,The primary motivation behind Darwin’s intense focus on transmutation research was an attempt – driven by an urgent need –  to explore radical ideas about natural selection and create an expansive theory based on his observations and experimentation with plants and animals and an extensive network of experts who could contribute valuable knowledge. He aimed at rewriting his journal and obtaining an expert grant which ultimately enabled him greater success.,raw_avs_responses/avs_4p.csv
4,"How did Emma's religious beliefs initially develop, considering her intensive study and questioning, and how did her views change over time?",15,"Emma’s religious beliefs initially developed as an intensive study with Unitarianism as she’s found her family's silent turning around regarding her Trinitarian Creed – which she found challenging due her own desire for open dialogue – This wasn’t simply an adherence but rather an active questioning into where she could find her own truth. Her belief system stemmed from her upbringing within an Anglican village church where she deeply cherished her family's emphasis on inner feeling over established doctrine. This emphasis fostered her focus on an afterlife belief where she wanted closeness and an eternal connection with others – essentially an exploration into spiritual belonging beyond simply following rules. As an Unitarian, she actively sought understanding beyond mere text; her desire for an open dialogue fostered an inquisitive mindset that didn’t conform easily within her family's framework. This questioning ultimately steered her towards her current belief system’s core principles.",raw_avs_responses/avs_4p.csv
5,"How does the Royal (Dick) School of Veterinary Studies rank among the medical schools in the UK, and what is the relationship between Medicine and Veterinary Medicine within its structure?",9,"Here’s my response:

The Royal (Dick) School of Veterinary Studies ranks amongst the best medical schools in the UK as the second-ranked university by both the Guardian University Guide and the Times Higher Education World University Rankings in 2021. This ranking reflects its strong reputation as a world-leading veterinary medicine institution within an English-speaking context. And importantly, the school’s structure integrates Veterinary Medicine into its core curriculum and philosophy as an integral part of its medical school program.",raw_avs_responses/avs_4p.csv
6,What was the function of the south transept?,3,The south transept functioned as an ambulatory pathway that allowed for room above the cloisters used for storing abbey muniments.\n,raw_avs_responses/avs_4p.csv
7,What is the primary function of the Holyrood campus and how has it evolved over time?,6,"The primary function of the Holyrood campus was originally Moray House Institute for Education before merging with the university's school of Arts and Culture and Environment.  Over time, it’s evolved into an outreach center housing research and teaching facilities and an hospital for small and farm animals. This seems like an evolution driven by its purpose as an educational institution!",raw_avs_responses/avs_4p.csv
8,"Which Nobel Prizes have been associated with the University of Edinburgh alumni, faculty members, and researchers?",10,"Here’s what have been associated with the University of Edinburgh alumni before the 20th century:

*   **Nobel** Prize – for the Nobel equivalent prizes – have been associated with the University of Edinburgh alumni
*   **Robert Braithwaite** – This was an Olympic gold medalist
*   **Katherine Grainger** – This was an Olympic gold medalist
*   **Sir Chris Hoy** – This was an Olympic gold medalist
*   **Eric Liddell** – This was an Olympic gold medalist",raw_avs_responses/avs_4p.csv
9,"What is the primary function of the General Council, according to the provided text?",3,"According to the provided text, the primary function of the General Council consists of graduates, academic staff, current and former University Court members.
",raw_avs_responses/avs_4p.csv
10,What was the primary influence of Darwin’s work on the evolution of scientific thought?,5,The primary influence of Darwin’s work on evolutionary science was his proposition that all species of life have descended from common ancestors with modification over time. This fundamentally shifted how scientists viewed biodiversity and provided the foundation for modern evolutionary theory – including genetics and evolutionary synthesis – which continues to develop today.,raw_avs_responses/avs_4p.csv
11,"What is the central argument of Malthus's essay on Population, according to Darwin?",4,The central argument of Malthus's essay on Population was that human population growth beyond resources was ordained by God as get humans to work productively and show restraint as get seven of whom survived.,raw_avs_responses/avs_4p.csv
12,"In what year was Edna Healey's biography ""Emma Darwin: The inspirational wife of a genius"" published, and how many pages does it contain?",6,"Edna Healey's biography ""Emma Darwin: The inspirational wife of a genius"" was published for the year of **2008**, with an exact number not specified because there are multiple editions with differing page counts. However, I can provide an approximate number which includes all editions with similar details.",raw_avs_responses/avs_4p.csv
13,"Which building at the Holyrood campus was opened by Princess Anne in 2017, and what is its primary purpose?",4,"The £80 million O'Shea Hall at Holyrood was opened by Princess Anne in 2017, and its primary purpose was as an accommodation building for postgraduate students.",raw_avs_responses/avs_4p.csv
14,"What was the primary tension faced by Emma and Charles Darwin throughout their marriage, and how did they address these tensions?",35,"Okay! Let's break down Emma Darwin’s relationship with Charles Darwin during their marriage and address their primary tensions. The tension stemmed from several interwoven elements:

*   **Charles's Exploration & Doubt:** Charles Darwin’s fascination with transmutation – his belief that life could change into different forms – created an inherent tension with Emma’s faith and her desire for scientific observation through rigorous experimentation rather than dramatic claims about spontaneous creation. Emma feared that Charles’s pursuit would undermine her religious beliefs.
*   **Emma’s Commitment & Suffering:** Emma’s unwavering commitment and her profound grief over her children's losses – Anne and George – had deeply affected her and instilled fear that her husband's pursuit would be destructive or harmful. She struggled to find peace within her grief while simultaneously navigating his scientific obsession.
*   **Scientific vs. Religious Conflict:** Darwin’s work inherently involved confronting an ancient belief system – evolution – which threatened Emma’s worldview while Charles’s work would be challenged by her insistence on empirical evidence rather than an unquestioned belief system. This fundamental difference created an ongoing conflict between their worlds.


**How they addressed these tensions:**

Emma Darwin addressed these tensions through various methods:
*   **Faith-Based Communication:** Emma sought solace through prayer and her belief system, often referencing scripture or religious symbols alongside Charles’s scientific observations. This allowed her not be silenced by his scientific pursuits but guided his thought
*   **Emotional Support:** They spent countless hours talking about their fears and hopes – Anne’s illness and George’s passing – offering emotional support and reassurance which was invaluable during those challenging times.
*   **Quiet Observation:** Despite their disagreement regarding scientific truth they maintained an openness by quietly observing each other's thinking and actions
*   **Focusing on Love and Connection:** Emma emphasized their love and their commitment as husband and wife. They focused on building an environment based on trust and mutual respect that could withstand their differing views about evolution.
This demonstrates their ability as an couple- they maintained their faith as long as possible while acknowledging their disagreements.",raw_avs_responses/avs_4p.csv
15,"How did Darwin's upbringing and family influence his views on social and political issues, specifically regarding slavery, and his interactions with indigenous populations?",12,"Here’s an explanation based on your provided information:

Darwin’s upbringing as the grandson of Josiah Wedgwood -a prominent Whig reformer supporting electoral reforms - profoundly influenced his views on social and political issues regarding slavery. This upbringing instilled within him an unwavering opposition against slavery as he saw it as inherent injustice. This was compounded by his interactions with Yaghans (Fuegians), Jemmy Button, which further cemented his perspective – his description of their “societal savages” reflected his growing awareness of their brutal conditions and his commitment toward social reform. This exposure showed him his time was marked by an era where racial hierarchies were an issue as well as his social position reflecting his strong anti-slavery stance.",raw_avs_responses/avs_4p.csv
16,In what year was the Diagnostic Society of Edinburgh founded?,2,The Diagnostic Society of Edinburgh was founded in **1787**.,raw_avs_responses/avs_4p.csv
17,"According to Darwin, what did the book conclude about the nature of life, highlighting the concept of evolution and the end of a few forms being ""evolved"" into many?",8,"According Darwin concluded that *On the Origin of Species* presented evidence of evolution – highlighting his theory’s core tenets:

1.  **Evolution:** Darwin’s work presented strong evidence for evolution – specifically, *sexual selection*.
2.  **End of Forms:** He argued in favouring an *end* of many forms being ""evolved"" into many, indicating an ongoing process with variation and change within species.
",raw_avs_responses/avs_4p.csv
18,"What significant event took place on 6 July 1920 at the King's Buildings campus, and which department did the first new building house?",4,"On June 1920, King George V laid the foundation of the first new building (now called The Joseph Black Building), housing the Department of Chemistry.",raw_avs_responses/avs_4p.csv
19,What is the primary reason Darwin's theory of evolution was initially met with criticism?,3,The primary reason Darwin's theory of evolution was initially met with criticism was due to opponents deriding his description as Malthusian justification for the English industrial capitalism of the time.,raw_avs_responses/avs_4p.csv
20,"How did Edward the Confessor's rebuilding of Saint Peter's Abbey begin, and what was the primary purpose behind the project?",8,"Edward the Confessor began rebuilding Saint Peter's Abbey as an order for himself and his family’s burial and as part of an ambitious project to complete an abbey which was initially an existing pyramidal structure dating back approximately four centuries. This project was undertaken by Henry of Reynes as master mason as construction began on June 6th,1245 under Henry’s master mason Henry of Reynes .",raw_avs_responses/avs_4p.csv
21,What is the main function of the Edinburgh University Students' Association?,3,The main function of Edinburgh University Students' Association (EUSA) can be summarized as responsible for overseeing over 250 student societies within university and beyond.,raw_avs_responses/avs_4p.csv
22,"Based on the 2021 THE World University Rankings by Subject, which subject at Edinburgh University ranked 10th worldwide, and how did the university perform globally in Computer Science?",5,"Based on the rankings from 2021 THE World University Rankings by Subject, computer science at Edinburgh was ranked **1st** globally among universities as well as has been well-regarded as one of best places for NLP in the world.",raw_avs_responses/avs_4p.csv
23,"What is the significance of the Diagnostic Society of Edinburgh, and what connection does it have to the university?",10,"Here’s my answer:

The Diagnostic Society of Edinburgh holds significant significance as its oldest student debating society in the UK with its roots tracing back over four centuries! This society was founded by the University of Edinburgh in 1787 as an indirect association with Una Europa and Universitas 21 (international associations).  Edinburgh maintains strong ties with Heriot-Watt University for collaborative teaching and research opportunities alongside its historic connection with these international associations. In short – it’s an integral part of Edinburgh’s university identity and an established institution with an extensive history!",raw_avs_responses/avs_4p.csv
24,"What was the initial reaction of other members of the crew (particularly the Fuegians) to Darwin’s arrival on the ship, and how did this impact the voyage's progress?",25,"Okay! Let’s delve into the initial reactions of other crew members – particularly regarding the Fuegians – regarding Darwin’s arrival on the HMS Beagle. This provides an important context for understanding the voyage’s complexities and its profound impact on Darwin’s thinking. Here’s my answer following your instructions:

After delays, the voyage began on December 27th,1831; it lasted almost five years. As FitzRoy had intended, Darwin spent most of that time on land investigating geology and making natural history college

Darwin’s interaction with Yaghans (Fuegians) such as Jemmy Button during the second voyage of HMS Beagle had a profound impact on his view of indigenous peoples. At his arrival in Tierra del Fuego he made an colourful description of ""Fuegian savages."" This
ch_s>=== Survey voyage on HMS Beagle ===

Following arriving at Tierra del Fuego he made an colourful description of ""Fuegian savages."" This encounter deeply affected Darwin's understanding of indigenous peoples as they challenged his preconceived notions about their behavior and their relationship with nature. This encounter spurred him into an intensive period of investigation – one which was not completed by any other man. This interaction dramatically shifted Darwin’s perspective – he began seeing them not as primitive or savage but as possessing complex and sophisticated knowledge regarding their environment and their survival skills. This profound shift in Darwin's thinking ultimately led him to his groundbreaking *On the Origin of Species*.",raw_avs_responses/avs_4p.csv
25,What is the primary architectural style of the Main Library building?,2,The primary architectural style of the Main Library building was Brutalist style eight-storey nine-storey.,raw_avs_responses/avs_4p.csv
26,Could you please generate 3 questions for a quiz/examination based on the provided text?,10,"Okay! Here are three questions for quiz/examination based on your provided text:

**1.**  What can be inferred about Charles Darwin’s approach regarding honesty and conscientious doubts? Explain briefly why you think this seems particularly painful.
**2.**  What does your final statement about Charles Darwin’s “belonging” imply? How does this contrast with your earlier feelings impact your understanding?
**3.** Considering what was shared by your personal feelings with Charley and your desire for openness and honesty – what does this suggest about your relationship?",raw_avs_responses/avs_4p.csv
27,"Beyond weddings, what other significant events occurred at Westminster Abbey?",5,"Westminster Abbey isn't just about weddings! Beyond simply holding coronation ceremonies, there have been significant events at Westminster Abbey since Edward III’s reign when Henry III began rebuilding it as an abbey with Gothic style and as an shrine made with woodwork..",raw_avs_responses/avs_4p.csv
28,"What is the primary focus of the University's research activities, as highlighted in the document?",3,The primary focus of the University’s research activities as highlighted in the document – according in common with other ancient universities of Scotland –  is *to promote research*.,raw_avs_responses/avs_4p.csv
